p2authname,id,totaloprev,revised_nonoprev,fromloc,perc_ownsource,perc_fromloc,pos_op_rev,pos_nonop_rev,pos_fromloc,pos_perc_ownsource,pos_perc_fromloc
Jackson County Water and Sewage Authority,780,66297602,31389407,28532385,32.132633,29.207962,66297600,31389408,28532384,32.132633,29.207962
Jackson Housing Authority,781,3193892,4740181,0,59.74461,0,3193892,4740181,0,59.74461,0
Jasper County Hospital Authority,782,47826471,505368,505368,1.0456213,1.0456213,47826472,505368,505368,1.0456213,1.0456213
Jasper County Water and Sewer Authority,783,1626432,61725,61725,3.6563542,3.6563542,1626432,61725,61725,3.6563542,3.6563542
Jenkins County Development Authority,784,144527,598500,0,80.548889,0,144527,598500,0,80.548889,0
Jenkins County Hospital Authority,785,35727496,435988,0,1.2056029,0,35727496,435988,0,1.2056029,0
Join Development Authority of Mitchell County and Pelham,786,153340,208000,208000,57.563515,57.563515,153340,208000,208000,57.563515,57.563515
Joint Cartersville-Bartow County Regional Industrial Development Authority,787,0,0,0,,,0,0,0,,
"Joint Development Authority of Baker, Dougherty, Terrell, and Lee Counties",788,0,0,0,,,0,0,0,,
"Joint Development Authority of Banks, Habersham and Rabun Counties",789,663.6,355535,0,99.813698,0,663.59998,355535,0,99.813698,0
Joint Development Authority of Bartow County and Pickens County,790,0,0,0,,,0,0,0,,
"Joint Development Authority of Brooks, Colquitt, Grady, Mitchell, and Thomas Counties",791,991696,0,0,0,0,991696,0,0,0,0
Joint Development Authority of Burke County and City of Waynesboro,792,0,0,0,,,0,0,0,,
"Joint Development Authority of Carroll, Haralson, Polk, Heard and Troup Counties",793,45323,0,0,0,0,45323,0,0,0,0
"Joint Development Authority of Colquitt, Mitchell, Grady, Thomas and Brooks Counties",794,64045,0,0,0,0,64045,0,0,0,0
"Joint Development Authority of Dawson, Lumpkin and White Counties",795,0,0,0,,,0,0,0,,
"Joint Development Authority of Dekalb County, Newton County, and Gwinnett County",796,20000,0,0,0,0,20000,0,0,0,0
"Joint Development Authority of Fannin County, Towns County and Union County",797,0,18720,0,100,0,0,18720,0,100,0
"Joint Development Authority of Franklin, Hart and Stephens Counties",798,326276,1807838,475077,84.711411,22.261087,326276,1807838,475077,84.711411,22.261087
Joint Development Authority of Gilmer County and Pickens County,799,5000,0,0,0,0,5000,0,0,0,0
"Joint Development Authority of Hazlehurst, Lumber City and Telfair County",800,94579,1126401,1126401,92.253845,92.253845,94579,1126401,1126401,92.253845,92.253845
"Joint Development Authority of Jasper County, Morgan County, Newton County, and Walton County",801,1245250,1360640,0,52.214024,0,1245250,1360640,0,52.214024,0
"Joint Development Authority of Jeff Davis County, Hazlehurst and Denton, Georgia",802,7759071.97,1872752.25,1872752.25,19.44338,19.44338,7759072,1872752.3,1872752.3,19.44338,19.44338
Joint Development Authority of Meriwether County and the City of Hogansville,803,171160,1500000,0,89.758011,0,171160,1500000,0,89.758011,0
Joint Development Authority of Metropolitan Atlanta,804,179257,0,0,0,0,179257,0,0,0,0
Joint Development Authority of Northeast Georgia,805,0,0,0,,,0,0,0,,
Joint Development Authority of Winder-Barrow County,806,356626.52,299503,0,45.646935,0,356626.53,299503,0,45.646931,0
Joint Grady County Development Authority,807,1560483,1474716,420041,48.587128,13.838994,1560483,1474716,420041,48.587128,13.838994
"Joint Public Safety and Judicial Facilities Authority for the Cities of Sandy Springs, Georgia and J",808,30464766,0,0,0,0,30464766,0,0,0,0
Kennesaw Development Authority,809,1708114,20000,20000,1.1573311,1.1573311,1708114,20000,20000,1.1573311,1.1573311
Kennesaw Downtown Development Authority,810,298953,422902,372902,58.585449,51.658852,298953,422902,372902,58.585449,51.658852
Kingsland Area Tourism Authority,811,2673265.34,0,0,0,0,2673265.3,0,0,0,0
Kingsland Development Authority,812,3423444.06,50000,0,1.4394934,0,3423444,50000,0,1.4394935,0
Kingsland Downtown Development Authority,813,109353.58,0,0,0,0,109353.58,0,0,0,0
Kingston Downtown Development Authority,814,0,0,0,,,0,0,0,,
LaFayette Hospital Authority,815,0,0,0,,,0,0,0,,
LaFayette Housing Authority,816,4900901,4248470,0,46.434559,0,4900901,4248470,0,46.434559,0
LaGrange Development Authority,817,19165916,13381125,6265125,41.113186,19.249445,19165916,13381125,6265125,41.113186,19.249445
LaGrange-Troup County Hospital Authority,818,1184513224,39590,0,.0033421896,0,1184513280,39590,0,.0033421894,0
Lake Allatoona Preservation Authority,819,838535.74,331250,131250,28.317152,11.220003,838535.75,331250,131250,28.317152,11.220003
Lake Oconee Area Development Authority,820,0,0,0,,,0,0,0,,
Lamar County Livestock and Agricultural Exposition Authority,821,140289,31027,31027,18.110975,18.110975,140289,31027,31027,18.110975,18.110975
Lamar County Regional Solid Waste Authority,822,23695151,326612,404,1.3596504,.0016818083,23695152,326612,404,1.3596504,.0016818083
Lamar County Water and Sewer Authority,823,3342769,2151866,0,39.163036,0,3342769,2151866,0,39.163036,0
Lanier Joint Development Authority,824,0,0,0,,,0,0,0,,
Laurens County Public Facilities Authority,825,0,0,0,,,0,0,0,,
Laurens County Solid Waste Management Authority,826,5839136,37310,0,.63490754,0,5839136,37310,0,.63490754,0
Laurens-Treutlen Joint Development Authority,827,0,0,0,,,0,0,0,,
Lavonia Downtown Development Authority,828,296453,0,0,0,0,296453,0,0,0,0
Lee County Utilities Authority,829,30920934,93500,0,.30147254,0,30920934,93500,0,.30147254,0
Liberty County Fire Authority,830,0,0,0,,,0,0,0,,
Liberty County Industrial Authority,831,18159748,3158272,0,14.815035,0,18159748,3158272,0,14.815035,0
Liberty County Industrial Development Authority,832,21509738,6909682,0,24.31324,0,21509738,6909682,0,24.31324,0
Liberty County Public Facilities Authority,833,0,0,0,,,0,0,0,,
Liberty County Solid Waste Authority,834,19272403,183250,90481,.94188565,.46506277,19272404,183250,90481,.94188559,.46506277
Lilburn Downtown Development Authority,835,84769.39000000001,0,0,0,0,84769.391,0,0,0,0
Lincoln County Development Authority,836,4167954.25,794843.2387695313,0,16.016031,0,4167954.3,794843.25,0,16.016033,0
Lincoln County Recreation Authority,837,55.67,0,0,0,0,55.669998,0,0,0,0
Lithonia Downtown Development Authority,838,0,0,0,,,0,0,0,,
Loganville Development Authority,839,0,0,0,,,0,0,0,,
Long County Housing Authority,840,0,0,0,,,0,0,0,,
Lower Chattahoochee Regional Airport Authority,841,18629,542671.33984375,21925,96.681099,3.9061084,18629,542671.31,21925,96.681099,3.9061086
Lower Chattahoochee Regional E-911 Authority,842,2186200,0,0,0,0,2186200,0,0,0,0
Lower Chattahoochee Regional Transportation Authority,843,12000,512778,0,97.713318,0,12000,512778,0,97.713318,0
Lowndes County Public Facilities Authority,844,0,0,0,,,0,0,0,,
"Lowndes, Lanier, Berrien, Echols, & Clinch Development Authority",845,0,0,0,,,0,0,0,,
Lumpkin County Public Building Authority,846,0,0,0,,,0,0,0,,
Lumpkin County Water & Sewerage Authority,847,11331643,0,0,0,0,11331643,0,0,0,0
Lumpkin Downtown Development Authority,848,4416.7,0,0,0,0,4416.7002,0,0,0,0
Lyons Downtown Development Authority,849,0,0,0,,,0,0,0,,
Macon Water Authority,850,446841535,2173531,-2950437,.4840664,-.65709084,446841536,2173531,0,.4840664,0
Macon-Bibb County Hospital Authority,851,58080000,0,0,0,0,58080000,0,0,0,0
Macon-Bibb County Industrial Authority,852,9066568,10292663,5967280,53.166695,30.823952,9066568,10292663,5967280,53.166695,30.823952
Macon-Bibb County Transit Authority,853,5723191,19194535,10638023,77.031647,42.692593,5723191,19194536,10638023,77.031647,42.692589
Macon-Bibb County Urban Development Authority,854,1676387,3872847,3872847,69.790657,69.790657,1676387,3872847,3872847,69.790657,69.790657
Madison County Industrial Development and Building Authority,855,5771591,2088114,754188,26.567333,9.5956278,5771591,2088114,754188,26.567333,9.5956278
Madison-Morgan County Airport Authority,856,0,0,0,,,0,0,0,,
Main Street Dublin-The Downtown Development Authority of Dublin,857,654642.46,426911,426911,39.472019,39.472019,654642.44,426911,426911,39.472019,39.472019
Manchester Public Utilities Authority,858,0,0,0,,,0,0,0,,
Marion County Development Authority,859,25543.92,0,0,0,0,25543.92,0,0,0,0
Marshallville Downtown Development Authority,860,0,0,0,,,0,0,0,,
McDuffie County Hospital Authority,861,121128247,2503193,2458573,2.0247221,1.9886309,121128248,2503193,2458573,2.0247221,1.9886309
McIntosh County Industrial Development Authority,862,6295907,728988,0,10.377209,0,6295907,728988,0,10.377209,0
McPherson Local Implementing Redevelopment Authority,863,0,3571928,818402,100,22.912052,0,3571928,818402,100,22.912052
Meriwether County Hospital Authority,864,80276521,0,0,0,0,80276520,0,0,0,0
Meriwether County Industrial Development Authority,865,6730439,2538189,0,27.384733,0,6730439,2538189,0,27.384733,0
Meriwether County Public Facilities Authority,866,0,0,0,,,0,0,0,,
Meriwether County Water and Sewerage Authority,867,2060496,1540702,1540702,42.783039,42.783039,2060496,1540702,1540702,42.783039,42.783039
Metropolitan Atlanta Rapid Transit Authority,868,561792,345510,0,38.081036,0,561792,345510,0,38.081036,0
Metter-Candler County Airport Authority,869,788784,2304587,455064,74.500824,14.710941,788784,2304587,455064,74.500824,14.710941
Middle Coastal Unified Development Authority,870,121498,0,0,0,0,121498,0,0,0,0
Middle Flint Regional E-911 Authority,871,15288533,1376720,0,8.2610207,0,15288533,1376720,0,8.2610207,0
Middle Georgia Coliseum Authority,872,0,0,0,,,0,0,0,,
Middle Georgia Regional Development Authority,873,5691.97,0,0,0,0,5691.9702,0,0,0,0
Middle Georgia Regional Solid Waste Management Authority,874,3039907,0,0,0,0,3039907,0,0,0,0
Milledgeville MainStreet/The Downtown Development Authority of the City of Milledgeville,875,999321.0600000001,208742.296875,208742.3,17.279085,17.279085,999321.06,208742.3,208742.3,17.279085,17.279085
Miller County Development Authority,876,453069,331966,160333,42.286777,20.423676,453069,331966,160333,42.286777,20.423676
Mitchell County Development Authority,877,769086,703000,0,47.755363,0,769086,703000,0,47.755363,0
Mitchell County Hospital Authority,878,0,0,0,,,0,0,0,,
Monroe County Industrial Development Authority,879,0,0,0,,,0,0,0,,
Monroe County Public Facilities Authority,880,110498,0,0,0,0,110498,0,0,0,0
Montezuma Downtown Development Authority,881,58717,20649,0,26.017439,0,58717,20649,0,26.017439,0
Montgomery County Development Authority,882,33223,161175,161175,82.909805,82.909805,33223,161175,161175,82.909805,82.909805
Morgan County Building Authority,883,0,0,0,,,0,0,0,,
Morgan County Hospital Authority,884,121947000,7784000,7780000,6.0001078,5.9970245,121947000,7784000,7780000,6.0001078,5.9970245
Morgan County Water Authority,885,0,0,0,,,0,0,0,,
Morrow Housing Authority,886,4875,87000,87000,94.693878,94.693878,4875,87000,87000,94.693878,94.693878
Moultrie-Colquitt County Development Authority,887,397320,5046481,2675000,92.701424,49.138462,397320,5046481,2675000,92.701424,49.138462
Murray County Hospital Authority,888,6635022,0,0,0,0,6635022,0,0,0,0
Murray County Industrial Development Authority,889,0,0,0,,,0,0,0,,
Murray County Water and Sewer Authority,890,0,0,0,,,0,0,0,,
Nashville Downtown Development Authority,891,0,0,0,,,0,0,0,,
Navy Supply Corps School Local Redevelopment Authority,892,0,0,0,,,0,0,0,,
Newnan Convention Center Authority,893,860831.74,0,0,0,0,860831.75,0,0,0,0
Newnan-Coweta County Airport Authority,894,10215501,6378171,1221115,38.43737,7.3589196,10215501,6378171,1221115,38.43737,7.3589196
Newton County Hospital Authority,895,800614571.41,0,0,0,0,800614592,0,0,0,0
Newton County Industrial Development Authority,896,236275,275000,0,53.787102,0,236275,275000,0,53.787102,0
Newton County Solid Waste Authority,897,22046336,3625,0,.016439939,0,22046336,3625,0,.016439939,0
Newton County Water and Sewerage Authority,898,135840072,931483,0,.68105024,0,135840064,931483,0,.6810503,0
Nicholson Water Authority,899,4010767,1773,0,.044186477,0,4010767,1773,0,.044186477,0
Norcross Development Authority,900,0,0,0,,,0,0,0,,
North Fulton Regional Radio System Authority,901,0,300000,300000,100,100,0,300000,300000,100,100
North Georgia Solid Waste Management Authority,902,422012,760788,757227,64.32093,64.019867,422012,760788,757227,64.32093,64.019867
Northeast Georgia Housing Authority,903,2815179,8071204,0,74.140366,0,2815179,8071204,0,74.140366,0
Northeast Georgia Regional Solid Waste Management Authority,904,0,0,0,,,0,0,0,,
Northwest Georgia Housing Authority,905,18996672.73,71182317.5,422481,78.934479,.46849161,18996672,71182320,422481,78.934479,.46849158
Northwest Georgia Joint Development Authority,906,6868,297233,297233,97.741539,97.741539,6868,297233,297233,97.741539,97.741539
Notla Water System,907,15951116,345823,0,2.1220119,0,15951116,345823,0,2.1220119,0
Oak Grove Cemetery Authority,908,31731,0,0,0,0,31731,0,0,0,0
Ocilla-Irwin County Industrial Development Authority,909,963506,1218931,1207015,55.85183,55.305836,963506,1218931,1207015,55.85183,55.305836
Oconee County Industrial Development Authority,910,1664138,19842558,1192557,92.26223,5.5450497,1664138,19842558,1192557,92.26223,5.5450497
Oconee County Public Facilities Authority,911,0,0,0,,,0,0,0,,
Oglethorpe Downtown Development Authority,912,0,0,0,,,0,0,0,,
Okefenokee Area Development Authority,913,224159,585883,585883,72.327484,72.327484,224159,585883,585883,72.327484,72.327484
Palmetto Housing Authority,914,1342076.62,0,0,0,0,1342076.6,0,0,0,0
Paulding County Airport Authority,915,1206391,3673338,3673338,75.277496,75.277496,1206391,3673338,3673338,75.277496,75.277496
Paulding County Hospital Authority,916,0,0,0,,,0,0,0,,
Paulding County Industrial Building Authority,917,3124742,0,0,0,0,3124742,0,0,0,0
Peach County Hospital Authority,918,56561403,950180,900000,1.6521541,1.5649022,56561404,950180,900000,1.6521541,1.5649021
Peach County Water & Sewerage Authority,919,0,0,0,,,0,0,0,,
Peachtree City Airport Authority,920,21744804,15614926,50000,41.796143,.13383394,21744804,15614926,50000,41.796143,.13383394
Peachtree City Water and Sewerage Authority,921,75799183,0,0,0,0,75799184,0,0,0,0
Pelham Housing Authority,922,4692376,6224592,0,57.01759,0,4692376,6224592,0,57.01759,0
Perkins Water Authority,923,88923.14,0,0,0,0,88923.141,0,0,0,0
Perry Area Convention and Visitors Bureau Authority,924,4627260,22500,22500,.48389596,.48389596,4627260,22500,22500,.48389596,.48389596
Perry-Houston County Airport Authority,925,2991658,4431194,1043865,59.696651,14.062856,2991658,4431194,1043865,59.696651,14.062856
Pickens County Airport Authority,926,0,0,0,,,0,0,0,,
Pierce County Industrial Development and Building,927,0,0,0,,,0,0,0,,
Pierce County Industrial Development and Building Authority,928,64735,120000,120000,64.957916,64.957916,64735,120000,120000,64.957916,64.957916
Pike County Agribusiness Authority,929,63348.49,114869,114869,64.454391,64.454391,63348.488,114869,114869,64.454391,64.454391
Pike County Arts Facility Authority,930,0,0,0,,,0,0,0,,
Pike County Recreation Authority,931,639873,2006376,1920595,75.819626,72.578018,639873,2006376,1920595,75.819626,72.578018
Pike County Water and Sewerage Authority,932,549708,1214724,1137653,68.845047,64.477013,549708,1214724,1137653,68.845047,64.477013
Pine Lake Downtown Development Authority,933,0,0,0,,,0,0,0,,
"Polk County Water, Sewage and Solid Waste Authority",934,325122676,0,0,0,0,325122688,0,0,0,0
Pooler Development Authority,935,289257.66,0,0,0,0,289257.66,0,0,0,0
Port Wentworth Downtown Development Authority,936,0,0,0,,,0,0,0,,
Powder Springs Downtown Development Authority,937,1399,10626,10626,88.365906,88.365906,1399,10626,10626,88.365906,88.365906
Pulaski County Hospital Authority,938,0,0,0,,,0,0,0,,
Pulaski County School Building Authority,939,0,0,0,,,0,0,0,,
Pulaski County-Hawkinsville Development Authority,940,107897562,0,0,0,0,107897560,0,0,0,0
Pulaski-Wilcox County Regional Jail Authority,941,70580,0,0,0,0,70580,0,0,0,0
Putnam Development Authority,942,356000.76,1770136.58984375,989616.39,83.255981,46.545273,356000.75,1770136.6,989616.38,83.255989,46.545269
Quitman County Development Authority,943,0,83159,0,100,0,0,83159,0,100,0
Quitman Urban Redevelopment Authority,944,0,0,0,,,0,0,0,,
Quitman-Brooks County Airport Authority,945,102104,2918134,245429,96.619339,8.1261473,102104,2918134,245429,96.619339,8.1261473
Rabun County Building Authority,946,397,0,0,0,0,397,0,0,0,0
Rabun County Convention and Visitors Bureau Authority,947,266608.35,27148.76953125,27148.77,9.24191,9.2419109,266608.34,27148.77,27148.77,9.2419109,9.2419109
Rabun County Economic Development Authority,948,194532.34,1126870.953125,1126870.96,85.278351,85.278351,194532.34,1126871,1126871,85.278351,85.278351
Rabun County Hospital Authority,949,24752234,87024,0,.35034862,0,24752234,87024,0,.35034862,0
Rabun County Water and Sewer Authority,950,0,129000,129000,100,100,0,129000,129000,100,100
Randolph County Development Authority,951,414516,19081,19081,4.40063,4.40063,414516,19081,19081,4.40063,4.40063
Redevelopment Authority of Clayton County,952,1835640,0,0,0,0,1835640,0,0,0,0
Reidsville Airport Authority,953,389244.83,600487.7001953125,3435,60.671715,.34706345,389244.84,600487.69,3435,60.671715,.34706345
Remerton Downtown Development Authority,954,0,19935,19935,100,100,0,19935,19935,100,100
Residential Care Facilities For The Elderly Authority of Columbia County,955,0,0,0,,,0,0,0,,
Residential Care Facilities for the Elderly Authority of Athens-Clarke County,956,0,0,0,,,0,0,0,,
Residential Care Facilities for the Elderly Authority of DeKalb County,957,124733.13,0,0,0,0,124733.13,0,0,0,0
Residential Care Facilities for the Elderly Authority of Fulton County,958,346164,0,0,0,0,346164,0,0,0,0
Residential Care Facilities for the Elderly Authority of Gwinnett County,959,0,0,0,,,0,0,0,,
"Residential Care Facilities for the Elderly Authority of Lowndes County, Georgia",960,23323656,0,0,0,0,23323656,0,0,0,0
Residential Care Facilities for the Elderly Authority of Whitfield County,961,0,0,0,,,0,0,0,,
Residential Care Facilities for the Elderly of Coweta County,962,0,0,0,,,0,0,0,,
Resource Recovery Development Authority for the City of Savannah,963,68383043,0,0,0,0,68383040,0,0,0,0
Resource Recovery Development Authority of Bartow County,964,0,0,0,,,0,0,0,,
Resource Recovery Development Authority of Cherokee County,965,2880488,4872882.1875,4872882.17,62.848568,62.848568,2880488,4872882,4872882,62.848568,62.848568
"Resource Recovery Development Authority of Columbus, Ga",966,0,0,0,,,0,0,0,,
Richmond County Hospital Authority,967,73716281,15450964,0,17.328072,0,73716280,15450964,0,17.328072,0
Richmond Hill Convention and Visitors Bureau,968,1276768,0,0,0,0,1276768,0,0,0,0
Riverdale Development Authority,969,19704,0,0,0,0,19704,0,0,0,0
Rochelle Housing Authority,970,163920,408154,0,71.346367,0,163920,408154,0,71.346367,0
Rockdale County Water and Sewerage Authority,971,0,0,0,,,0,0,0,,
Rockmart Development Authority,972,649244,0,0,0,0,649244,0,0,0,0
Rome-Floyd County Development Authority,973,1478043,1236702,1236702,45.554996,45.554996,1478043,1236702,1236702,45.554996,45.554996
Rome-Floyd County Land Bank Authority,974,0,0,0,,,0,0,0,,
Sandersville Downtown Development Authority,975,14224.84,33760.42993164063,36896,70.35582,76.890259,14224.84,33760.43,36896,70.35582,76.890266
Sardis Development Authority,976,0,0,0,,,0,0,0,,
Satilla Regional Water and Sewer Authority,977,24040359,6522920,470000,21.342344,1.5377932,24040360,6522920,470000,21.342342,1.537793
Savannah Economic Development Authority,978,56033645,239475,239475,.42555842,.42555842,56033644,239475,239475,.42555842,.42555842
Schley-Sumter-Macon Counties Joint Development Authority,979,1830.44,0,0,0,0,1830.4399,0,0,0,0
Screven County Development Authority,980,71947,4298244,3390351,98.353691,77.57901,71947,4298244,3390351,98.353691,77.57901
Screven County Hospital Authority,981,41857000,647075,405000,1.5223835,.95284981,41857000,647075,405000,1.5223835,.95284981
Screven County Public Facilities Authority,982,0,0,0,,,0,0,0,,
Sinclair Water Authority,983,12076547.63,0,0,0,0,12076548,0,0,0,0
Smyrna Downtown Area Development Corporation,984,4382535,0,0,0,0,4382535,0,0,0,0
Smyrna Housing Authority,985,1069870,0,0,0,0,1069870,0,0,0,0
Social Circle Development Authority,986,258236,110494,110494,29.966101,29.966101,258236,110494,110494,29.966101,29.966101
"Solid Waste Management Authority of Athens-Clarke County, Georgia",987,14126921,0,0,0,0,14126921,0,0,0,0
Solid Waste Management Authority of Atkinson County,988,28029318,180000,180000,.63808703,.63808703,28029318,180000,180000,.63808703,.63808703
Solid Waste Management Authority of Augusta,989,37612869,0,0,0,0,37612868,0,0,0,0
Solid Waste Management Authority of Charlton County,990,0,0,0,,,0,0,0,,
Solid Waste Management Authority of Columbia County,991,8492074,0,0,0,0,8492074,0,0,0,0
Solid Waste Management Authority of Crisp County,992,180348928,0,0,0,0,180348928,0,0,0,0
"Solid Waste Management Authority of Franklin County, Georgia",993,193281,0,0,0,0,193281,0,0,0,0
"Solid Waste Management Authority of the City of LaGrange, Georgia",994,0,0,0,,,0,0,0,,
South Fulton Municipal Regional Jail Authority,995,46726698.27,0,0,0,0,46726700,0,0,0,0
South Fulton Municipal Regional Water and Sewer Authority,996,32000,0,0,0,0,32000,0,0,0,0
South Georgia Business and Development Authority,997,30642,0,0,0,0,30642,0,0,0,0
South Georgia Governmental Services Authority,998,59419373,470822,0,.78614205,0,59419372,470822,0,.78614205,0
South Georgia Hospital Authority,999,21288,0,0,0,0,21288,0,0,0,0
South Georgia Regional Information Technology Authority,1000,8448484,3911146,18450,31.644524,.14927632,8448484,3911146,18450,31.644524,.14927632
South Regional Joint Development Authority,1001,64000,0,0,0,0,64000,0,0,0,0
Southeast Georgia Consolidated Housing Authority,1002,2079076,5015076,0,70.6931,0,2079076,5015076,0,70.6931,0
Southeast Georgia Joint Development Authority,1003,4682614,0,0,0,0,4682614,0,0,0,0
Southeast Georgia Regional Development Authority,1004,1662899.41,3251491.5,0,66.162659,0,1662899.4,3251491.5,0,66.162659,0
Southwest Georgia Regional Development Authority,1005,0,276606.1796875,0,100,0,0,276606.19,0,100,0
Southwest Georgia Technology Authority,1006,0,32000,5000,100,15.625,0,32000,5000,100,15.625
"Spalding County Collaborative for Families & Children, Inc.",1007,1112172,168595,15598,13.163596,1.217864,1112172,168595,15598,13.163596,1.217864
Spalding County Water and Sewerage Facilities Authority,1008,74813903,0,0,0,0,74813904,0,0,0,0
Sparta-Hancock County Development Authority,1009,4395,275695,163195,98.430862,58.265202,4395,275695,163195,98.430862,58.265202
Sparta-Hancock Public Facilities Authority,1010,0,0,0,,,0,0,0,,
St. Marys Airport Authority,1011,262567.19,78314.59375,0,22.974121,0,262567.19,78314.594,0,22.974121,0
St. Marys Convention and Visitors Bureau Authority,1012,124444,506990,506990,80.291847,80.291847,124444,506990,506990,80.291847,80.291847
St. Marys Downtown Development Authority,1013,190928,0,0,0,0,190928,0,0,0,0
Stephens County Development Authority,1014,1017830,8677157,8217573,89.50148,84.761055,1017830,8677157,8217573,89.50148,84.761055
Stephens County Hospital Authority,1015,548180834,87391,87391,.015939461,.015939461,548180864,87391,87391,.015939461,.015939461
Stephens County School Building Authority,1016,0,0,0,,,0,0,0,,
Sumter County Industrial Development Authority,1017,0,0,0,,,0,0,0,,
Sumter County Livestock Authority,1018,628909,0,0,0,0,628909,0,0,0,0
Suwanee Downtown Development Authority,1019,77104,75110,75110,49.345001,49.345001,77104,75110,75110,49.345001,49.345001
Swainsboro Emanuel County Parks and Recreation Aut,1020,0,0,0,,,0,0,0,,
Swainsboro Emanuel County Parks and Recreation Authority,1021,0,0,0,,,0,0,0,,
Sylvania-Screven County Airport Authority,1022,68810,0,0,0,0,68810,0,0,0,0
Sylvester Development Authority,1023,0,0,0,,,0,0,0,,
Tallapoosa Development Authority,1024,1354207,2986750,0,68.803955,0,1354207,2986750,0,68.803955,0
Tallapoosa Recreation Authority,1025,1985902,0,0,0,0,1985902,0,0,0,0
Tattnall County Development Authority,1026,399639.49,133146,133146,24.990545,24.990545,399639.5,133146,133146,24.990545,24.990545
Taylor County Airport Authority,1027,188242,1598210,0,89.462799,0,188242,1598210,0,89.462799,0
Taylor County Building Authority,1028,277841,0,0,0,0,277841,0,0,0,0
Taylor County Development Authority,1029,361506,0,0,0,0,361506,0,0,0,0
Taylor County Waste Management Authority,1030,0,0,0,,,0,0,0,,
Taylor County Water and Sewerage Authority,1031,0,0,0,,,0,0,0,,
Telfair County Hospital Authority,1032,532230,0,0,0,0,532230,0,0,0,0
Telfair-Wheeler Airport Authority,1033,0,1247803,55861,100,4.4767485,0,1247803,55861,100,4.4767485
Telfair-Wheeler Joint E-911 Authority,1034,498157,0,0,0,0,498157,0,0,0,0
Temple Downtown Development Authority,1035,0,0,0,,,0,0,0,,
Terrell County Airport Authority,1036,464954,1427757,222055,75.434494,11.732113,464954,1427757,222055,75.434494,11.732113
Terrell County Development Authority,1037,47478.46,0,0,0,0,47478.461,0,0,0,0
The Atlanta Development Authority,1038,8480093,0,0,0,0,8480093,0,0,0,0
The Atlanta Development Authority d/b/a Invest Atlanta,1039,30570784,0,0,0,0,30570784,0,0,0,0
The Baxley and Appling County Hospital Authority,1040,230000168,1538409,1538409,.66442883,.66442883,230000160,1538409,1538409,.66442883,.66442883
The City of Austell Public Facilities Authority,1041,4709889,0,0,0,0,4709889,0,0,0,0
The City of Colquitt Downtown Development Authority,1042,0,410000,410000,100,100,0,410000,410000,100,100
The Commerce Civic Center and Tourism Authority,1043,861971.78,10000,0,1.1468261,0,861971.75,10000,0,1.1468261,0
