p2authname,id,totaloprev,revised_nonoprev,fromloc,perc_ownsource,perc_fromloc,pos_op_rev,pos_nonop_rev,pos_fromloc,pos_perc_ownsource,pos_perc_fromloc
Glennville Development Authority,530,55450,115000,115000,67.468468,67.468468,55450,115000,115000,67.468468,67.468468
Glennville Downtown Development Authority,531,90,35000,35000,99.743515,99.743515,90,35000,35000,99.743515,99.743515
Glynn-Brunswick Memorial Hospital Authority,532,1316313959,0,0,0,0,1316313984,0,0,0,0
Gordon County - Floyd County Development Authority,533,0,0,0,,,0,0,0,,
Gordon Downtown Development Authority,534,0,0,0,,,0,0,0,,
Grady County Hospital Authority,535,0,0,0,,,0,0,0,,
Grady County Joint Development Authority,536,1241182,621986,163769,33.383247,8.789814,1241182,621986,163769,33.383247,8.789814
Greene County Airport Authority,537,1361964,1343638,428044,49.661331,15.820657,1361964,1343638,428044,49.661331,15.820657
Greene County Development Authority,538,237821,946848,946848,79.92511,79.92511,237821,946848,946848,79.92511,79.92511
Greene County Hospital Authority,539,22570614,1455814,980000,6.0592194,4.0788417,22570614,1455814,980000,6.0592194,4.0788417
Griffin-Spalding County Airport Authority,540,0,0,0,,,0,0,0,,
Griffin-Spalding County Development Authority,541,2303919,17175240,16641099,88.172386,85.430275,2303919,17175240,16641099,88.172386,85.430275
Griffin-Spalding County Hospital Authority,542,25904415,0,0,0,0,25904416,0,0,0,0
Griffin-Spalding County Land Bank Authority,543,0,1763516.375,695971.35,100,39.464977,0,1763516.4,695971.38,100,39.464981
Gwinnett County Airport Authority,544,0,0,0,,,0,0,0,,
Gwinnett County Arts Facility Authority,545,0,0,0,,,0,0,0,,
Gwinnett County Recreation Authority,546,3784211,0,0,0,0,3784211,0,0,0,0
Gwinnett County Water and Sewerage Authority,547,428876499,0,0,0,0,428876512,0,0,0,0
Habersham County Airport Authority,548,37775,17334,17334,31.454027,31.454027,37775,17334,17334,31.454027,31.454027
Habersham County Development Authority,549,1529450.8,495867.5625,495867.56,24.483438,24.483438,1529450.8,495867.56,495867.56,24.483438,24.483438
Habersham County Water and Sewerage Authority,550,0,58628,58628,100,100,0,58628,58628,100,100
Hall County Water and Sewer Authority,551,1405194,0,0,0,0,1405194,0,0,0,0
Hancock County Hospital Authority,552,0,0,0,,,0,0,0,,
Hapeville Development Authority,553,105360,8500,8500,7.4653082,7.4653082,105360,8500,8500,7.4653082,7.4653082
Haralson County School Building Authority,554,0,6461031,6461031,100,100,0,6461031,6461031,100,100
Haralson County Solid Waste Management Authority,555,3647408,324685,111037,8.1741543,2.795428,3647408,324685,111037,8.1741543,2.795428
Haralson County Water Authority,556,28225848,304893,304893,1.0686473,1.0686473,28225848,304893,304893,1.0686473,1.0686473
Harris County Public Improvements Authority,557,239098,1860636,1658616,88.612938,78.991722,239098,1860636,1658616,88.612938,78.991722
Hart County Industrial Building Authority,558,76309,1733915,1564557,95.784554,86.428917,76309,1733915,1564557,95.784554,86.428917
Hart County Industrial Development Authority,559,0,0,0,,,0,0,0,,
Hart County Water and Sewer Utility Authority,560,8248384,6513118,3185832,44.122326,21.582031,8248384,6513118,3185832,44.122326,21.582031
Hawkinsville Development Authority,561,846101,0,0,0,0,846101,0,0,0,0
Hawkinsville Downtown Development Authority,562,0,185916,185916,100,100,0,185916,185916,100,100
Hawkinsville Housing Authority,563,1911054,3446296,0,64.328369,0,1911054,3446296,0,64.328369,0
Hazlehurst Downtown Development Authority,564,0,0,0,,,0,0,0,,
Heard County Hospital Authority,565,381182.9900000001,0,0,0,0,381183,0,0,0,0
Heard County Public Facilities Authority,566,189008.48,0,0,0,0,189008.48,0,0,0,0
Heard County Water Authority,567,18881393,2579062,264419,12.017741,1.2321221,18881392,2579062,264419,12.017742,1.2321221
Heart of Georgia Regional Airport Authority,568,2592033,8234816,1203921,76.059212,11.119773,2592033,8234816,1203921,76.059212,11.119773
Heart of Georgia Regional Solid Waste Authority,569,0,0,0,,,0,0,0,,
Henry County Development Authority,570,2562911,0,0,0,0,2562911,0,0,0,0
Henry County Flying Authority,571,7,0,0,0,0,7,0,0,0,0
Henry County Governmental Services Authority,572,155109935,27019770,0,14.835455,0,155109936,27019770,0,14.835455,0
Henry County Water Authority,573,184433823,0,0,0,0,184433824,0,0,0,0
Henry County Water and Sewerage Authority,574,194438581,0,0,0,0,194438576,0,0,0,0
Hogansville Development Authority,575,111.76,0,0,0,0,111.76,0,0,0,0
Hogansville Downtown Development Authority,576,119340.89,51293.51000976563,51293.51,30.060474,30.060474,119340.89,51293.512,51293.512,30.060474,30.060474
"Hospital Authority of Albany-Dougherty County, Georgia",577,37214030,85234652,0,69.608467,0,37214032,85234656,0,69.608467,0
Hospital Authority of Bacon County,578,49426651,0,0,0,0,49426652,0,0,0,0
Hospital Authority of Ben Hill County,579,175812319,0,0,0,0,175812320,0,0,0,0
Hospital Authority of Bleckley County,580,24292945,67453,67453,.27689612,.27689612,24292944,67453,67453,.27689615,.27689615
Hospital Authority of Bulloch County,581,18663558,-3513572,-3513572,-23.191916,-23.191916,18663558,0,0,0,0
"Hospital Authority of Calhoun County, Georgia",582,49491813,1056065,1056065,2.089237,2.089237,49491812,1056065,1056065,2.0892372,2.0892372
Hospital Authority of Candler County,583,141011588.39,450837,259786,.31869736,.18364312,141011584,450837,259786,.31869736,.18364312
Hospital Authority of Charlton County,584,62438078,4325966,4325966,6.4794846,6.4794846,62438080,4325966,4325966,6.4794846,6.4794846
Hospital Authority of Cherokee County,585,0,0,0,,,0,0,0,,
Hospital Authority of Clarke County Georgia,586,0,0,0,,,0,0,0,,
"Hospital Authority of Clay County, Georgia",587,0,0,0,,,0,0,0,,
Hospital Authority of Cobb County,588,0,0,0,,,0,0,0,,
Hospital Authority of Colquitt County,589,891426978,0,0,0,0,891427008,0,0,0,0
"Hospital Authority of Columbus, Georgia",590,225929335,0,0,0,0,225929328,0,0,0,0
Hospital Authority of Crisp County,591,0,0,0,,,0,0,0,,
"Hospital Authority of Dooly County, Georgia",592,0,0,0,,,0,0,0,,
Hospital Authority of Douglas County,593,0,0,0,,,0,0,0,,
"Hospital Authority of Early County, Georgia",594,865548,0,0,0,0,865548,0,0,0,0
Hospital Authority of Effingham County,595,373226635,29453083,29369750,7.3142705,7.2935758,373226624,29453084,29369750,7.3142705,7.2935758
Hospital Authority of Evans County,596,26576091,0,0,0,0,26576092,0,0,0,0
Hospital Authority of Fayette County,597,0,0,0,,,0,0,0,,
Hospital Authority of Floyd County,598,2657359436,15885622,1750535,.5942449,.065483518,2657359360,15885622,1750535,.5942449,.065483525
Hospital Authority of Forsyth County,599,0,0,0,,,0,0,0,,
Hospital Authority of Fulton County,600,33917657,0,0,0,0,33917656,0,0,0,0
Hospital Authority of Gordon County,601,100675,0,0,0,0,100675,0,0,0,0
"Hospital Authority of Gwinnett County, Georgia",602,140306045,0,0,0,0,140306048,0,0,0,0
Hospital Authority of Hart County,603,1888215,0,0,0,0,1888215,0,0,0,0
Hospital Authority of Henry County,604,1319673833,0,0,0,0,1319673856,0,0,0,0
Hospital Authority of Houston County,605,932425174,86503,0,.0092763454,0,932425152,86503,0,.0092763454,0
Hospital Authority of Irwin County,606,143249933,0,0,0,0,143249936,0,0,0,0
Hospital Authority of Jefferson County and the City of Louisville,607,150259392,221333,0,.14708395,0,150259392,221333,0,.14708395,0
Hospital Authority of Liberty County,608,260228386,15318681,15318681,5.55937,5.55937,260228384,15318681,15318681,5.55937,5.55937
Hospital Authority of Lumpkin County,609,406112,0,0,0,0,406112,0,0,0,0
Hospital Authority of Marion County,610,2465850,-770114,-100500,-45.414734,-5.92663,2465850,0,0,0,0
Hospital Authority of Miller County,611,203746004,1829782,497116,.89007664,.24181642,203746000,1829782,497116,.89007664,.24181642
Hospital Authority of Monroe County,612,108327000,0,0,0,0,108327000,0,0,0,0
Hospital Authority of Pulaski County,613,8000,0,0,0,0,8000,0,0,0,0
Hospital Authority of Putnam County,614,129961000,5909000,5475000,4.34901,4.0295873,129961000,5909000,5475000,4.34901,4.0295873
Hospital Authority of Randolph County,615,134671472,160066,0,.11871555,0,134671472,160066,0,.11871555,0
Hospital Authority of Rockdale County,616,11679954,0,0,0,0,11679954,0,0,0,0
Hospital Authority of St. Marys,617,171257,0,0,0,0,171257,0,0,0,0
"Hospital Authority of Tattnall County, Georgia",618,0,0,0,,,0,0,0,,
Hospital Authority of Union County,619,0,0,0,,,0,0,0,,
Hospital Authority of Upson County,620,0,0,0,,,0,0,0,,
"Hospital Authority of Valdosta and Lowndes County, Georgia",621,2836375585,0,0,0,0,2836375552,0,0,0,0
"Hospital Authority of Walker, Dade and Catoosa Counties",622,0,0,0,,,0,0,0,,
Hospital Authority of Ware County,623,0,0,0,,,0,0,0,,
Hospital Authority of Washington County,624,268396179,12548259,5539981,4.4664559,1.9719133,268396176,12548259,5539981,4.4664559,1.9719135
"Hospital Authority of Wayne County, Georgia",625,507460873,10866467,0,2.0964487,0,507460864,10866467,0,2.0964487,0
Hospital Authority of Wilkes County,626,150234034,266020,250000,.17675741,.1661129,150234032,266020,250000,.17675741,.1661129
Hospital Authority of the City of Bainbridge and Decatur County,627,410542262,0,0,0,0,410542272,0,0,0,0
Hospital Authority of the City of Bremen and County of Haralson,628,302101,0,0,0,0,302101,0,0,0,0
Hospital Authority of the City of Lavonia,629,0,0,0,,,0,0,0,,
"Hospital Authority of the City of Newnan, Georgia",630,0,0,0,,,0,0,0,,
"Hospital Authority of the City of Royston, Georgia",631,0,0,0,,,0,0,0,,
"Hospital Authority of the City of Smyrna, Georgia",632,0,0,0,,,0,0,0,,
Hospital Authority of the City of Thomasville,633,3100000,0,0,0,0,3100000,0,0,0,0
"Housing Authority City of Sylvester, GA",634,5413726,8598072,0,61.363087,0,5413726,8598072,0,61.363087,0
Housing Authority of City of Carrollton,635,18638046,18681194,965163,50.057808,2.5862343,18638046,18681194,965163,50.057808,2.5862343
Housing Authority of City of Danielsville,636,628976,963256,0,60.497215,0,628976,963256,0,60.497215,0
Housing Authority of Clayton County,637,4181193,2044355,120000,32.838154,1.9275411,4181193,2044355,120000,32.838154,1.9275411
Housing Authority of Cobb County,638,3127141,0,0,0,0,3127141,0,0,0,0
"Housing Authority of Columbus, Georgia",639,137269339,224722953,5137828,62.079487,1.4193197,137269344,224722960,5137828,62.079487,1.4193196
Housing Authority of Fulton County,640,110168715,21040899,0,16.036095,0,110168712,21040900,0,16.036097,0
Housing Authority of Gwinnett County,641,2408770,-20000,-20000,-.83725095,-.83725095,2408770,0,0,0,0
Housing Authority of Lee County,642,4628960,2103623,131541,31.245407,1.953797,4628960,2103623,131541,31.245407,1.953797
Housing Authority of Savannah,643,14943527,131479212,74665,89.794258,.050992765,14943527,131479216,74665,89.794258,.050992761
Housing Authority of Screven County,644,356140,0,0,0,0,356140,0,0,0,0
Housing Authority of the City of Acworth,645,1378267.02,1344347,0,49.377068,0,1378267,1344347,0,49.377068,0
"Housing Authority of the City of Adel, Georgia",646,802225,2344704,0,74.50769,0,802225,2344704,0,74.50769,0
Housing Authority of the City of Alamo,647,541822,868268,0,61.575359,0,541822,868268,0,61.575359,0
Housing Authority of the City of Albany,648,53374950,1868286,0,3.3819273,0,53374952,1868286,0,3.381927,0
Housing Authority of the City of Ashburn,649,3190898,4448937,0,58.233418,0,3190898,4448937,0,58.233418,0
"Housing Authority of the City of Athens, Georgia",650,106220894,13558882,0,11.319842,0,106220896,13558882,0,11.319842,0
"Housing Authority of the City of Augusta, Georgia",651,70090484,388201842,20000,84.706161,.0043640267,70090480,388201856,20000,84.706161,.0043640267
Housing Authority of the City of Bainbridge,652,1238206,516213,0,29.423588,0,1238206,516213,0,29.423588,0
Housing Authority of the City of Baxley,653,1800193,2857898,0,61.353416,0,1800193,2857898,0,61.353416,0
Housing Authority of the City of Blackshear,654,752315,1632233,0,68.450417,0,752315,1632233,0,68.450417,0
"Housing Authority of the City of Blakely, Georgia",655,2065035,4445961,0,68.283882,0,2065035,4445961,0,68.283882,0
Housing Authority of the City of Buena Vista,656,2146019,1829845,0,46.023834,0,2146019,1829845,0,46.023834,0
"Housing Authority of the City of Buford, Georgia",657,6988474,6804072,0,49.331516,0,6988474,6804072,0,49.331516,0
Housing Authority of the City of Byron,658,62071,150910,0,70.856087,0,62071,150910,0,70.856087,0
"Housing Authority of the City of Cairo, Georgia",659,5854751.3,2689442,26842,31.476839,.31415486,5854751.5,2689442,26842,31.476839,.31415486
Housing Authority of the City of Calhoun,660,3949337,5539408,0,58.378723,0,3949337,5539408,0,58.378723,0
Housing Authority of the City of Camilla,661,19843892,2605955,0,11.607897,0,19843892,2605955,0,11.607897,0
Housing Authority of the City of Canton,662,4430501,7698650,0,63.47229,0,4430501,7698650,0,63.47229,0
Housing Authority of the City of Cave Spring,663,488688,2800567,0,85.142899,0,488688,2800567,0,85.142899,0
"Housing Authority of the City of Cedartown, Ga.",664,6751484,3197721,0,32.140469,0,6751484,3197721,0,32.140469,0
"Housing Authority of the City of Clarkesville, Ga.",665,355672,750534,0,67.84758,0,355672,750534,0,67.84758,0
Housing Authority of the City of Clarkston,666,0,0,0,,,0,0,0,,
"Housing Authority of the City of Clayton, Georgia",667,910117,2705275,0,74.826599,0,910117,2705275,0,74.826599,0
"Housing Authority of the City of Cleveland, Ga.",668,125333,242919,0,65.965424,0,125333,242919,0,65.965424,0
Housing Authority of the City of College Park,669,13464550,15931405,0,54.195908,0,13464550,15931405,0,54.195908,0
Housing Authority of the City of Colquitt,670,1950365,1791989,0,47.884007,0,1950365,1791989,0,47.884007,0
Housing Authority of the City of Conyers,671,7530189,3676950,0,32.808998,0,7530189,3676950,0,32.808998,0
"Housing Authority of the City of Cordele, Georgia",672,13049670,10680451,4483,45.007992,.018891603,13049670,10680451,4483,45.007992,.018891603
"Housing Authority of the City of Cornelia, Ga.",673,1239217,2384007,0,65.797943,0,1239217,2384007,0,65.797943,0
Housing Authority of the City of Covington,674,9059065,5861278,200658,39.283802,1.3448619,9059065,5861278,200658,39.283802,1.3448619
Housing Authority of the City of Crawfordville,675,143446,196463,0,57.798706,0,143446,196463,0,57.798706,0
Housing Authority of the City of Cumming,676,1401774,917475,0,39.559143,0,1401774,917475,0,39.559143,0
"Housing Authority of the City of Cuthbert, GA",677,6588244,6577516,0,49.959259,0,6588244,6577516,0,49.959259,0
Housing Authority of the City of Dahlonega,678,145578,170670,0,53.96714,0,145578,170670,0,53.96714,0
Housing Authority of the City of Dawson,679,1995051,5006026,0,71.503654,0,1995051,5006026,0,71.503654,0
"Housing Authority of the City of Decatur, Georgia",680,50126696.22,83354150,878734.02,62.446526,.65832216,50126696,83354152,878734,62.446526,.65832216
"Housing Authority of the City of Doerun, Georgia",681,0,0,0,,,0,0,0,,
"Housing Authority of the City of Dublin, Georgia",682,12987956.88,23172659,0,64.082588,0,12987957,23172660,0,64.082588,0
"Housing Authority of the City of East Point, Georgia",683,28990068,30725522,0,51.453098,0,28990068,30725522,0,51.453098,0
Housing Authority of the City of Eastman,684,2863455,1857652,0,39.347805,0,2863455,1857652,0,39.347805,0
Housing Authority of the City of Eatonton,685,6015869,3675846,0,37.927715,0,6015869,3675846,0,37.927715,0
"Housing Authority of the City of Edison, GA.",686,959375,3116717,0,76.463364,0,959375,3116717,0,76.463364,0
"Housing Authority of the City of Elberton, Georgia",687,238349,752439,0,75.943489,0,238349,752439,0,75.943489,0
Housing Authority of the City of Ellaville,688,1080563,823306,0,43.243835,0,1080563,823306,0,43.243835,0
"Housing Authority of the City of Ellijay, Georgia",689,1669341,1511790,3853,47.523663,.12112045,1669341,1511790,3853,47.523663,.12112045
Housing Authority of the City of Fitzgerald,690,3506700,8690769,0,71.250595,0,3506700,8690769,0,71.250595,0
Housing Authority of the City of Forsyth,691,6918.05,0,0,0,0,6918.0498,0,0,0,0
Housing Authority of the City of Fort Gaines,692,716107,1157503,0,61.779293,0,716107,1157503,0,61.779293,0
"Housing Authority of the City of Fort Oglethorpe, Georgia",693,706282,1019463,0,59.073792,0,706282,1019463,0,59.073792,0
Housing Authority of the City of Gainesville,694,13404765,13625691,35000,50.408661,.12948357,13404765,13625691,35000,50.408661,.12948357
Housing Authority of the City of Glennville,695,1732294,2336292,0,57.422703,0,1732294,2336292,0,57.422703,0
Housing Authority of the City of Glenwood,696,450433,447921,0,49.860188,0,450433,447921,0,49.860188,0
Housing Authority of the City of Grantville,697,535258,691099,0,56.353817,0,535258,691099,0,56.353817,0
"Housing Authority of the City of Greensboro, Georgia",698,1970817,1762483,0,47.209789,0,1970817,1762483,0,47.209789,0
Housing Authority of the City of Griffin,699,2580622,11185365,0,81.253639,0,2580622,11185365,0,81.253639,0
"Housing Authority of the City of Hahira, Georgia",700,260020,793469,0,75.318207,0,260020,793469,0,75.318207,0
"Housing Authority of the City of Harlem, Georgia",701,546716,515383,0,48.524948,0,546716,515383,0,48.524948,0
Housing Authority of the City of Hartwell,702,3636573,5135110,0,58.541901,0,3636573,5135110,0,58.541901,0
"Housing Authority of the City of Hinesville, Ga",703,7306970,10860135,0,59.779118,0,7306970,10860135,0,59.779118,0
Housing Authority of the City of Hogansville,704,2216637,2990595,0,57.431568,0,2216637,2990595,0,57.431568,0
"Housing Authority of the City of Homerville, Georgia",705,733504,0,0,0,0,733504,0,0,0,0
Housing Authority of the City of Jasper,706,2876284,4621330,0,61.637341,0,2876284,4621330,0,61.637341,0
Housing Authority of the City of Jefferson,707,1602531,2468033,0,60.631229,0,1602531,2468033,0,60.631229,0
Housing Authority of the City of Jesup,708,2538680,3853420,0,60.2841,0,2538680,3853420,0,60.2841,0
"Housing Authority of the City of Lakeland, Georgia",709,245309,1010564,0,80.467056,0,245309,1010564,0,80.467056,0
Housing Authority of the City of Lavonia,710,3793400,7017981,22567,64.912903,.20873374,3793400,7017981,22567,64.912903,.20873374
"Housing Authority of the City of Lawrenceville, GA",711,6505709,5503369,35000,45.82674,.29144618,6505709,5503369,35000,45.82674,.29144618
"Housing Authority of the City of Lithonia, Georgia",712,5824819,8884934,0,60.401653,0,5824819,8884934,0,60.401653,0
"Housing Authority of the City of Loganville, GA",713,417683,855960,0,67.205643,0,417683,855960,0,67.205643,0
Housing Authority of the City of Louisville,714,2094535,0,0,0,0,2094535,0,0,0,0
"Housing Authority of the City of Macon, Georgia",715,293291159,74414580,0,20.237535,0,293291168,74414576,0,20.237534,0
"Housing Authority of the City of Madison, GA",716,830402,2633954,0,76.030121,0,830402,2633954,0,76.030121,0
Housing Authority of the City of Marietta,717,110521934,128554368,13969303,53.771271,5.8430314,110521936,128554368,13969303,53.771271,5.8430314
Housing Authority of the City of McCaysville Georgia,718,153474,219143,0,58.811863,0,153474,219143,0,58.811863,0
Housing Authority of the City of McDonough,719,2951551,1421216,0,32.501526,0,2951551,1421216,0,32.501526,0
"Housing Authority of the City of Menlo, Georgia",720,2298447,873035,0,27.527666,0,2298447,873035,0,27.527666,0
Housing Authority of the City of Metter,721,2028151,5870230,0,74.321938,0,2028151,5870230,0,74.321938,0
Housing Authority of the City of Milledgeville,722,3818463,7480577,1282148,66.205421,11.347406,3818463,7480577,1282148,66.205421,11.347406
Housing Authority of the City of Millen,723,1606031,548668,0,25.463789,0,1606031,548668,0,25.463789,0
"Housing Authority of the City of Monroe, GA",724,5259443,16704538,0,76.054237,0,5259443,16704538,0,76.054237,0
Housing Authority of the City of Monticello,725,866961,2124913,0,71.022812,0,866961,2124913,0,71.022812,0
"Housing Authority of the City of Moultrie, Georgia",726,0,0,0,,,0,0,0,,
Housing Authority of the City of Mt. Vernon,727,245676,1472168,0,85.698586,0,245676,1472168,0,85.698586,0
Housing Authority of the City of Nahunta,728,339067,690074,0,67.053398,0,339067,690074,0,67.053398,0
"Housing Authority of the City of Nashville, Georgia",729,2689293,5662605,0,67.800217,0,2689293,5662605,0,67.800217,0
"Housing Authority of the City of Oakwood, Georgia",730,0,0,0,,,0,0,0,,
"Housing Authority of the City of Ocilla, Ga",731,2984232.95,4329875,0,59.198948,0,2984233,4329875,0,59.198948,0
"Housing Authority of the City of Pearson, Georgia",732,342254,902276,0,72.499336,0,342254,902276,0,72.499336,0
"Housing Authority of the City of Perry, Georgia",733,638618,1382630,0,68.40477,0,638618,1382630,0,68.40477,0
Housing Authority of the City of Quitman,734,3745665,7231535,0,65.877777,0,3745665,7231535,0,65.877777,0
Housing Authority of the City of Ringgold,735,460981,897918,0,66.076874,0,460981,897918,0,66.076874,0
"Housing Authority of the City of Roberta, GA.",736,500895,654751,0,56.656712,0,500895,654751,0,56.656712,0
"Housing Authority of the City of Rockmart, Ga.",737,267250,855741,0,76.20195,0,267250,855741,0,76.20195,0
"Housing Authority of the City of Rome, GA",738,3254872,8771864,0,72.936363,0,3254872,8771864,0,72.936363,0
Housing Authority of the City of Roswell,739,1655213,0,0,0,0,1655213,0,0,0,0
Housing Authority of the City of Royston,740,3475073,7413637,16798,68.085541,.15426987,3475073,7413637,16798,68.085541,.15426987
Housing Authority of the City of Sandersville,741,3222152,5074456,0,61.163021,0,3222152,5074456,0,61.163021,0
Housing Authority of the City of Senoia,742,1071002,472507,0,30.61252,0,1071002,472507,0,30.61252,0
Housing Authority of the City of Shellman,743,371244,1181106,0,76.08503,0,371244,1181106,0,76.08503,0
"Housing Authority of the City of Social Circle, GA",744,1078255,2687171,0,71.364326,0,1078255,2687171,0,71.364326,0
Housing Authority of the City of Soperton,745,928305,1846143,0,66.540909,0,928305,1846143,0,66.540909,0
Housing Authority of the City of Statesboro,746,2223103,6036275,0,73.083893,0,2223103,6036275,0,73.083893,0
"Housing Authority of the City of Sugar Hill, Georgia",747,14101.99,0,0,0,0,14101.99,0,0,0,0
Housing Authority of the City of Summerville,748,3646922,3645491,0,49.990189,0,3646922,3645491,0,49.990189,0
Housing Authority of the City of Swainsboro,749,5909733,3571560,0,37.669544,0,5909733,3571560,0,37.669544,0
Housing Authority of the City of Sylvania,750,1829226,17750,0,.96103036,0,1829226,17750,0,.96103036,0
"Housing Authority of the City of Tallapoosa, Georgia",751,5929032,5016857,0,45.833252,0,5929032,5016857,0,45.833252,0
Housing Authority of the City of Thomaston,752,8596597,11379992,0,56.96664,0,8596597,11379992,0,56.96664,0
"Housing Authority of the City of Thomasville, Georgia",753,1414060,544305,0,27.793848,0,1414060,544305,0,27.793848,0
"Housing Authority of the City of Thomson, Georgia",754,2365106,2654566,0,52.883255,0,2365106,2654566,0,52.883255,0
"Housing Authority of the City of Tifton, Georgia",755,4293587,885797,0,17.102362,0,4293587,885797,0,17.102362,0
"Housing Authority of the City of Toccoa, Ga.",756,772057,2506426,0,76.450783,0,772057,2506426,0,76.450783,0
Housing Authority of the City of Vidalia,757,1360705,2935993,0,68.331383,0,1360705,2935993,0,68.331383,0
Housing Authority of the City of Vienna,758,3782848,1359820,0,26.441917,0,3782848,1359820,0,26.441917,0
Housing Authority of the City of Villa Rica,759,2365461.82,0,0,0,0,2365461.8,0,0,0,0
"Housing Authority of the City of Warner Robins, Georgia",760,11885695,5305011,0,30.859762,0,11885695,5305011,0,30.859762,0
Housing Authority of the City of Warrenton,761,1217230,2065759,0,62.923119,0,1217230,2065759,0,62.923119,0
Housing Authority of the City of Waycross,762,5749737,12162022,0,67.899651,0,5749737,12162022,0,67.899651,0
Housing Authority of the City of Waynesboro,763,10926381,1231240,0,10.12731,0,10926381,1231240,0,10.12731,0
Housing Authority of the City of West Point,764,10055380,5697499,0,36.167984,0,10055380,5697499,0,36.167984,0
Housing Authority of the City of Winder,765,12895448,8180910,0,38.815578,0,12895448,8180910,0,38.815578,0
"Housing Authority of the City of Woodbury, Georgia",766,51244,136778,0,72.745743,0,51244,136778,0,72.745743,0
Housing Authority of the City of Wrightsville,767,1957442,3098637,0,61.285374,0,1957442,3098637,0,61.285374,0
"Housing Authority of the County of Atkinson, Georgia",768,203803,1005512,0,83.14724,0,203803,1005512,0,83.14724,0
"Housing Authority of the County of DeKalb, Georgia",769,367708128,281074578,22251589,43.323376,3.4297445,367708128,281074592,22251588,43.32338,3.4297442
Housing Authority of the County of Harris,770,1239453,1228310,0,49.774227,0,1239453,1228310,0,49.774227,0
"Housing Authority of the County of Houston, Georgia",771,328448,274413,0,45.518452,0,328448,274413,0,45.518452,0
"Housing Authority of the Town of Homer, Ga.",772,82107,168238,0,67.202461,0,82107,168238,0,67.202461,0
Houston County Development Authority,773,6587976,8686557,8486557,56.869541,55.560173,6587976,8686557,8486557,56.869541,55.560173
Ideal Downtown Development Authority,774,0,0,0,,,0,0,0,,
Industrial Development Authority of Austell,775,0,0,0,,,0,0,0,,
Industrial Development Authority of Butts County,776,58394,370442,370442,86.383141,86.383141,58394,370442,370442,86.383141,86.383141
Industrial Development Authority of the City of Buford,777,0,0,0,,,0,0,0,,
Jackson County Airport Authority,778,4716323,5309454,1877721,52.958031,18.728933,4716323,5309454,1877721,52.958031,18.728933
Jackson County Industrial Development Authority,779,839127,40198,40198,4.5714612,4.5714612,839127,40198,40198,4.5714612,4.5714612
