p2authname,id,totaloprev,revised_nonoprev,fromloc,perc_ownsource,perc_fromloc,pos_op_rev,pos_nonop_rev,pos_fromloc,pos_perc_ownsource,pos_perc_fromloc
Abbeville Housing Authority,1,149467,645298,0,81.193558,0,149467,645298,0,81.193558,0
Acworth Area Convention and Visitors Bureau Authority,2,253341,57060,57060,18.382673,18.382673,253341,57060,57060,18.382673,18.382673
Acworth Downtown Development Authority,3,56465,18569,18569,24.747448,24.747448,56465,18569,18569,24.747448,24.747448
Acworth Lake Authority,4,1250563,20000,20000,1.5741054,1.5741054,1250563,20000,20000,1.5741054,1.5741054
Adairsville Development Authority,5,912331,0,0,0,0,912331,0,0,0,0
Adairsville Downtown Development Authority,6,850,0,0,0,0,850,0,0,0,0
Adel Industrial Development Authority,7,572225,4277719,-130000,88.201408,-2.6804433,572225,4277719,0,88.201408,0
Adel-Cook County Tourism Authority,8,0,0,0,,,0,0,0,,
Albany Dougherty Payroll Development Authority,9,1943351,4066881,3966881,67.665955,66.002129,1943351,4066881,3966881,67.665955,66.002129
Albany-Dougherty Inner City Authority,10,3673353,300000,300000,7.5502982,7.5502982,3673353,300000,300000,7.5502982,7.5502982
Alcovy Shores Water and Sewerage Authority,11,905487,0,0,0,0,905487,0,0,0,0
Alma Downtown Development Authority,12,1885.59,0,0,0,0,1885.59,0,0,0,0
Americus Theater and Cultural Center Authority,13,766479,635079,635079,45.312359,45.312359,766479,635079,635079,45.312359,45.312359
Americus and Sumter County Hospital Authority,14,344732688,28391689,0,7.6091757,0,344732672,28391688,0,7.6091757,0
Americus-Sumter Payroll Development Authority,15,3612094,566294,379743,13.55293,9.0882654,3612094,566294,379743,13.55293,9.0882654
Arabi Industrial Development Authority,16,4,0,0,0,0,4,0,0,0,0
Arlington Housing Authority,17,260469,1182015,0,81.943024,0,260469,1182015,0,81.943024,0
Athens Public Facilities Authority,18,2985763,0,0,0,0,2985763,0,0,0,0
Athens-Clarke County Downtown Development Authority,19,3,0,0,0,0,3,0,0,0,0
Athens-Clarke County Industrial Development Authority,20,239953.38,0,0,0,0,239953.38,0,0,0,0
Athens-Clarke County Land Bank Authority,21,5000,0,0,0,0,5000,0,0,0,0
Athens-Clarke County Public Facilities Authority,22,2451184,183900,0,6.9789047,0,2451184,183900,0,6.9789047,0
Atkinson County-Coffee County Joint Development Authority,23,5698,0,0,0,0,5698,0,0,0,0
Atlanta Development Authority,24,11048380,1573382,1573382,12.465629,12.465629,11048380,1573382,1573382,12.465629,12.465629
Atlanta Public Safety and Judicial Facilities Authority,25,0,0,0,,,0,0,0,,
Atlanta Urban Redevelopment Agency,26,6323402,0,0,0,0,6323402,0,0,0,0
Auburn Downtown Development Authority,27,34649,0,0,0,0,34649,0,0,0,0
Augusta Canal Authority,28,10969872,22554008,15089939,67.277443,45.012508,10969872,22554008,15089939,67.277443,45.012508
Augusta Ports Authority,29,369883,0,0,0,0,369883,0,0,0,0
"Augusta, Georgia Landbank Authority",30,307012,165524,0,35.028866,0,307012,165524,0,35.028866,0
Augusta-Richmond County Coliseum Authority,31,10850175,0,0,0,0,10850175,0,0,0,0
Bacon County Development Authority,32,183229.01,1507798.3828125,1281178.2,89.164635,75.763306,183229.02,1507798.4,1281178.3,89.164635,75.763306
Bacon Industrial Building Authority,33,0,0,0,,,0,0,0,,
Baldwin County Hospital Authority,34,631916965,379366,0,.059998132,0,631916992,379366,0,.059998132,0
Banks County Industrial Building Authority,35,0,0,0,,,0,0,0,,
Banks-Jackson-Commerce Hospital and Nursing Home Authority,36,113415913,0,0,0,0,113415912,0,0,0,0
Barnesville Housing Authority,37,2466743,6887746,0,73.630379,0,2466743,6887746,0,73.630379,0
Barnesville-Lamar County Industrial Development Authority,38,5221690,2597860,36914,33.22263,.4720732,5221690,2597860,36914,33.22263,.4720732
Barrow County Airport Authority,39,3327878,5120505,0,60.609291,0,3327878,5120505,0,60.609291,0
Barrow County Water & Sewerage Authority,40,35510879,1079513,870154,2.9502635,2.3780942,35510880,1079513,870154,2.9502635,2.3780942
Bartow-Cartersville Joint Development Authority,41,3439907.81,1316000,0,27.670847,0,3439907.8,1316000,0,27.670849,0
Bartow-Cartersville Second Joint Development Authority,42,52750,0,0,0,0,52750,0,0,0,0
Ben Hill-Irwin Area Joint Development Authority,43,128088.43,0,0,0,0,128088.43,0,0,0,0
Berrien County Airport Authority,44,20202,1666568,0,98.80233,0,20202,1666568,0,98.80233,0
Berrien County Development Authority,45,1140466.36,1077676.69921875,144859.98,48.584633,6.5306869,1140466.4,1077676.8,144859.98,48.584637,6.5306869
Bleckley County School Building Authority,46,0,0,0,,,0,0,0,,
Bleckley-Cochran Development Authority,47,68645.28999999999,0,0,0,0,68645.289,0,0,0,0
Bleckley-Cochran Industrial Development Authority,48,59977892.44000001,0,0,0,0,59977892,0,0,0,0
Boston Downtown Development Authority,49,0,0,0,,,0,0,0,,
Bowdon Hospital Authority,50,404575,498226,0,55.186691,0,404575,498226,0,55.186691,0
Bowdon Housing Authority,51,648574,751182,0,53.665211,0,648574,751182,0,53.665211,0
Brantley County Development Authority,52,114818,255089,255089,68.960304,68.960304,114818,255089,255089,68.960304,68.960304
Braselton Downtown Development Authority,53,21461.51,0,0,0,0,21461.51,0,0,0,0
Braselton Visitors Bureau Authority,54,3805236,581221,0,13.250352,0,3805236,581221,0,13.250352,0
Bremen Housing Authority,55,750973,1311608,0,63.590618,0,750973,1311608,0,63.590618,0
Brookhaven Development Authority,56,0,0,0,,,0,0,0,,
Brooks County Development Authority,57,2573777,4486175,2514016,63.543987,35.609535,2573777,4486175,2514016,63.543987,35.609535
Brooks County Hospital Authority,58,0,0,0,,,0,0,0,,
Brunswick and Glynn County Development Authority,59,8952927,5287985,4230400,37.132347,29.705963,8952927,5287985,4230400,37.132347,29.705963
Brunswick-Glynn County Joint Water and Sewer Commission,60,100828732,50000,0,.049564462,0,100828736,50000,0,.049564458,0
Bryan County-Pembroke Development Authority,61,6091,662269,315260,99.088661,47.169189,6091,662269,315260,99.088661,47.169189
Building Authority of Fulton County,62,37712000,0,0,0,0,37712000,0,0,0,0
Burke County Economic Development Authority,63,178375,0,0,0,0,178375,0,0,0,0
Burke County Hospital Authority,64,15916205,218073,218073,1.351613,1.351613,15916205,218073,218073,1.351613,1.351613
Butts County Hospital Authority,65,2843060,6688579,6688579,70.172394,70.172394,2843060,6688579,6688579,70.172394,70.172394
"Butts County, City of Flovilla, City of Jackson, and City of Jenkinsburg Water and Sewer Authority",66,27813259,320647,8426,1.1397173,.029949628,27813260,320647,8426,1.1397173,.029949626
"Butts, Henry, Lamar and Spalding County Joint Development Authority",67,0,0,0,,,0,0,0,,
Byron  Development Authority,68,204213,450000,450000,68.784935,68.784935,204213,450000,450000,68.784935,68.784935
Byron Downtown Development Authority,69,0,0,0,,,0,0,0,,
Byron Redevelopment Authority,70,763804.5,0,0,0,0,763804.5,0,0,0,0
Calhoun Downtown Development Authority,71,37074,11494.1396484375,11494.14,23.666008,23.666008,37074,11494.14,11494.14,23.666008,23.666008
Calhoun Recreation Authority,72,185,4447638,4447638,99.995842,99.995842,185,4447638,4447638,99.995842,99.995842
Calhoun-Gordon County Airport Authority,73,5045076,3262207,1906193,39.269241,22.946047,5045076,3262207,1906193,39.269241,22.946047
Camden County Joint Development Authority,74,560557,4830040,4820302,89.601204,89.420563,560557,4830040,4820302,89.601204,89.420563
Camden County Public Service Authority,75,27983456.92,748371,0,2.604676,0,27983456,748371,0,2.604676,0
Camden County Solid Waste Management Authority,76,0,0,0,,,0,0,0,,
Candler County Industrial Authority,77,2266296,500000,0,18.074711,0,2266296,500000,0,18.074711,0
Canton Building Authority,78,279396.53,0,0,0,0,279396.53,0,0,0,0
Canton Development Authority,79,0,0,0,,,0,0,0,,
Carroll City/County Hospital Authority,80,23257464,0,0,0,0,23257464,0,0,0,0
Carroll County Solid Waste Management Authority,81,5175592,0,0,0,0,5175592,0,0,0,0
Carroll County Water Authority,82,89062493,36971,0,.041494075,0,89062496,36971,0,.041494075,0
Carrollton Payroll Development Authority,83,436381,3849812,1024510,89.818916,23.902563,436381,3849812,1024510,89.818916,23.902563
Carrollton Redevelopment Authority,84,0,0,0,,,0,0,0,,
Cartersville Building Authority,85,19619,0,0,0,0,19619,0,0,0,0
Cartersville Development Authority,86,37135,0,0,0,0,37135,0,0,0,0
Cartersville Downtown Development Authority,87,704593.11,854008,842870,54.793236,54.078621,704593.13,854008,842870,54.793236,54.078621
Cartersville-Bartow County Airport Authority,88,1751784,178620,0,9.252985,0,1751784,178620,0,9.252985,0
Catoosa County Development Authority,89,1641699,1569636,1369636,48.877991,42.650051,1641699,1569636,1369636,48.877991,42.650051
Catoosa County Public Works Authority,90,950993,7512,0,.78372049,0,950993,7512,0,.78372049,0
Catoosa County Solid Waste Management Authority,91,904917,0,0,0,0,904917,0,0,0,0
Cedartown Development Authority,92,0,0,0,,,0,0,0,,
Cedartown Downtown Development Authority,93,197606,361091,356091,64.63092,63.735977,197606,361091,356091,64.63092,63.735977
Cedartown Polk County Hospital Authority,94,832728,0,0,0,0,832728,0,0,0,0
Central Georgia Joint Development Authority,95,44714452,12200000,12200000,21.43568,21.43568,44714452,12200000,12200000,21.43568,21.43568
Central Savannah River Area Unified Development Authority,96,20856,173110,0,89.247597,0,20856,173110,0,89.247597,0
Central Valdosta Development Authority,97,2227535,0,0,0,0,2227535,0,0,0,0
Charlton-Folkston-Homeland Airport Authority,98,0,0,0,,,0,0,0,,
Chatham Area Transit Authority,99,22910045,16116525,0,41.296288,0,22910044,16116525,0,41.296291,0
Chatham County Hospital Authority,100,3775583000,0,0,0,0,3775582976,0,0,0,0
Chatham County Recreation Authority,101,196000,0,0,0,0,196000,0,0,0,0
Chatham-Savannah Authority for the Homeless,102,3812088,4908704,272834,56.287365,3.1285462,3812088,4908704,272834,56.287365,3.1285462
Chatham-Savannah Youth Futures Authority,103,0,5532603,2656656,100,48.018192,0,5532603,2656656,100,48.018192
Chattahoochee County Industrial Development Authority,104,12711.21,7846,7846,38.166656,38.166656,12711.21,7846,7846,38.166656,38.166656
Chattooga County Development Authority,105,8509,0,0,0,0,8509,0,0,0,0
Chehaw Park Authority,106,6766950.15,10150690,10041896,60.000626,59.357544,6766950,10150690,10041896,60.000626,59.357548
Cherokee County Airport Authority,107,657682.87,16210633,4639000,96.101074,27.501263,657682.88,16210633,4639000,96.101074,27.501263
Cherokee County Development Authority,108,1844445,587681,587681,24.163263,24.163263,1844445,587681,587681,24.163263,24.163263
Cherokee County Parks and Recreation Authority,109,4425081,19493642,19493642,81.499512,81.499512,4425081,19493642,19493642,81.499512,81.499512
Cherokee County Water and Sewerage Authority,110,504585600,0,0,0,0,504585600,0,0,0,0
Chicopee Woods Area Park Commission,111,2526742,0,0,0,0,2526742,0,0,0,0
City of Alpharetta Development Authority,112,1996158,0,0,0,0,1996158,0,0,0,0
City of Alpharetta Downtown Development Authority,113,0,0,0,,,0,0,0,,
City of Atlanta Fulton County Recreation Authority,114,15949917,0,0,0,0,15949917,0,0,0,0
City of Atlanta Solid Waste Management Authority,115,0,0,0,,,0,0,0,,
City of Bainbridge Public Facilities Authority,116,0,0,0,,,0,0,0,,
City of Barnesville and County of Lamar Development Authority,117,0,0,0,,,0,0,0,,
City of Cairo Development Authority,118,2146553,0,0,0,0,2146553,0,0,0,0
City of Cairo Downtown Development Authority,119,359829,0,0,0,0,359829,0,0,0,0
City of Claxton Downtown Development Authority,120,43857,10000,10000,18.567688,18.567688,43857,10000,10000,18.567688,18.567688
City of Clayton Downtown Development Authority,121,0,0,0,,,0,0,0,,
City of Commerce Downtown Development Authority,122,935942.6899999999,618411.91015625,547211.91,39.785767,35.20509,935942.69,618411.94,547211.94,39.78577,35.20509
City of Covington Downtown Development Authority,123,0,0,0,,,0,0,0,,
City of Covington Parking Authority,124,143980.1,0,0,0,0,143980.09,0,0,0,0
City of Cumming Development Authority,125,0,0,0,,,0,0,0,,
City of Dalton Airport Authority,126,1394633,3031551,0,68.491302,0,1394633,3031551,0,68.491302,0
City of Dalton Building Authority,127,0,0,0,,,0,0,0,,
City of Dawson Development Authority,128,0,0,0,,,0,0,0,,
City of Decatur Parking Authority,129,0,0,0,,,0,0,0,,
City of Dublin and County of Laurens Development Authority,130,4545364,10646368,9025882,70.080017,59.41312,4545364,10646368,9025882,70.080017,59.41312
City of Duluth Downtown Development Authority,131,35218,1640683,1590683,97.89856,94.915092,35218,1640683,1590683,97.89856,94.915092
City of Fayetteville Downtown Development Authority,132,2974873,0,0,0,0,2974873,0,0,0,0
City of Grayson Downtown Development Authority,133,92211.31999999999,165000,165000,64.14959,64.14959,92211.32,165000,165000,64.14959,64.14959
City of Hartwell Recreation Authority,134,0,0,0,,,0,0,0,,
City of Homerville Water and Sewer Authority,135,3017153,0,0,0,0,3017153,0,0,0,0
City of Jasper Industrial Authority,136,0,0,0,,,0,0,0,,
City of Jefferson Public Building Authority,137,0,0,0,,,0,0,0,,
City of Jesup Downtown Development Authority,138,241396,332455,298905,57.934029,52.087563,241396,332455,298905,57.934029,52.087563
City of LaGrange Gas Authority,139,151497.92,5581397,5581397,97.357391,97.357391,151497.92,5581397,5581397,97.357391,97.357391
City of Milan Development Authority,140,0,0,0,,,0,0,0,,
City of Milton Public Building and Facilities Authority,141,685699.2,0,0,0,0,685699.19,0,0,0,0
City of Monroe Convention and Visitors Bureau,142,3675,135865,135865,97.366348,97.366348,3675,135865,135865,97.366348,97.366348
City of Moultrie-Colquitt County Airport Authority,143,483337.11,1784047,508010,78.683052,22.405115,483337.13,1784047,508010,78.683052,22.405113
City of Peachtree City Public Facilities Authority,144,0,0,0,,,0,0,0,,
City of Pearson Public Facilities Authority,145,0,0,0,,,0,0,0,,
"City of Pearson, Georgia Industrial Authority",146,0,273961,273961,100,100,0,273961,273961,100,100
City of Perry Industrial Building Authority,147,30114,0,0,0,0,30114,0,0,0,0
City of Rome Recreational Facilities Authority,148,0,0,0,,,0,0,0,,
City of Rome School Building Authority,149,0,0,0,,,0,0,0,,
City of Sandy Springs Development Authority,150,360851,0,0,0,0,360851,0,0,0,0
City of Sandy Springs Public Facilities Authority,151,0,0,0,,,0,0,0,,
"City of Stockbridge, Georgia Downtown Development Authority",152,0,0,0,,,0,0,0,,
City of Sugar Hill Downtown Development Authority,153,0,0,0,,,0,0,0,,
City of Trenton Downtown Development Authority,154,45117,18180,17435,28.721741,27.54475,45117,18180,17435,28.721741,27.54475
City of Vienna Solid Waste Management Authority,155,112281,0,0,0,0,112281,0,0,0,0
City of Villa Rica Public Facilities Authority,156,0,5168050,5168050,100,100,0,5168050,5168050,100,100
City of Warner Robins Redevelopment Agency,157,2351497,0,0,0,0,2351497,0,0,0,0
City of Washington Downtown Development Authority,158,17460,2100,2100,10.736197,10.736197,17460,2100,2100,10.736197,10.736197
City of Washington Urban Redevelopment Authority,159,3.05,2500,2500,99.878151,99.878151,3.05,2500,2500,99.878151,99.878151
City of Willacoochee Development Authority,160,0,0,0,,,0,0,0,,
Clarke County Airport Authority,161,26994821,1915835,1059759,6.6267433,3.6656346,26994820,1915835,1059759,6.6267438,3.6656346
Clarkesville Downtown Development Authority,162,0,0,0,,,0,0,0,,
Classic Center Authority for Clarke County,163,40827741,19647644,16272466,32.488663,26.907585,40827740,19647644,16272466,32.488663,26.907585
Clay County Development Authority,164,719,0,0,0,0,719,0,0,0,0
Clayton County Airport Authority,165,6748041,1255756,0,15.689504,0,6748041,1255756,0,15.689504,0
Clayton County Hospital Authority,166,22385133,0,0,0,0,22385132,0,0,0,0
Clayton County Solid Waste Management Authority,167,29137578,0,0,0,0,29137578,0,0,0,0
Clayton County Tourism Authority,168,8043017,0,0,0,0,8043017,0,0,0,0
Clayton County Water Authority,169,885186484,2022186,0,.22792676,0,885186496,2022186,0,.22792676,0
Clayton-Rabun County Water and Sewer Authority,170,4205984,1569682,915091,27.177507,15.843904,4205984,1569682,915091,27.177507,15.843904
Clinch County Development Authority,171,2591892,630120,0,19.556725,0,2591892,630120,0,19.556725,0
Clinch County Hospital Authority,172,105194518,142982,6000,.13573703,.0056959772,105194520,142982,6000,.13573703,.0056959772
Cobb County Kennestone Hospital Authority,173,0,0,0,,,0,0,0,,
Cobb County Recreation Authority,174,14918939,0,0,0,0,14918939,0,0,0,0
Cobb County Solid Waste Management Authority,175,42930903,121415,0,.28201732,0,42930904,121415,0,.28201732,0
Cobb County-Marietta Water Authority,176,631597803,696313,0,.11012486,0,631597824,696313,0,.11012486,0
Cobb-Marietta Coliseum and Exhibit Hall Authority,177,175067411,129563556,129563556,42.531315,42.531315,175067408,129563552,129563552,42.531315,42.531315
Coffee County Hospital Authority,178,159572,0,0,0,0,159572,0,0,0,0
College Park Business and Industrial Development Authority,179,6180500,0,0,0,0,6180500,0,0,0,0
Columbia County Airport Authority,180,0,0,0,,,0,0,0,,
Columbus Airport Commission,181,49181849,20257135,28456,29.172567,.040979862,49181848,20257136,28456,29.172569,.040979862
Columbus Building Authority,182,0,0,0,,,0,0,0,,
Columbus Industrial and Port Development Commission,183,0,0,0,,,0,0,0,,
"Consolidated Housing Authority of Talbot County, Georgia",184,189793,724121,0,79.232948,0,189793,724121,0,79.232948,0
Conyers Downtown Development Authority,185,136994,0,0,0,0,136994,0,0,0,0
Conyers-Rockdale-Big Haynes Impoundment Authority,186,0,0,0,,,0,0,0,,
Cook County Airport Authority,187,0,0,0,,,0,0,0,,
Coosa Water Authority,188,5182568,12400,12400,.23869252,.23869252,5182568,12400,12400,.23869252,.23869252
Coosawattee Regional Water and Sewerage Authority,189,0,0,0,,,0,0,0,,
Cordele Office Building Authority,190,1135794,0,0,0,0,1135794,0,0,0,0
Covington Municipal Airport Authority,191,30340,0,0,0,0,30340,0,0,0,0
Covington Redevelopment Authority,192,49294,0,0,0,0,49294,0,0,0,0
Coweta County Development Authority,193,4722758,240602,240602,4.8475628,4.8475628,4722758,240602,240602,4.8475628,4.8475628
Coweta County Hospital Authority,194,495611,0,0,0,0,495611,0,0,0,0
Coweta County Solid Waste Authority,195,7728473,0,0,0,0,7728473,0,0,0,0
Coweta County Water and Sewerage Authority,196,180035448,0,0,0,0,180035456,0,0,0,0
"Coweta, Fayette, Meriwether Joint Development Authority",197,0,0,0,,,0,0,0,,
Crisp County Hospital Authority,198,0,0,0,,,0,0,0,,
Crisp County-Cordele Industrial Development Authority,199,3870836.71,3036373.078125,354901.33,43.959473,5.1381288,3870836.8,3036373,354901.34,43.959473,5.1381288
Crisp-Dooly Joint Development Authority,200,1929226,0,0,0,0,1929226,0,0,0,0
Dade County Industrial Development Authority,201,393301,0,0,0,0,393301,0,0,0,0
Dade County Water and Sewer Authority,202,31547521,0,0,0,0,31547520,0,0,0,0
Dahlonega Downtown Development Authority,203,589277,165652,165652,21.942726,21.942726,589277,165652,165652,21.942726,21.942726
Dalton-Whitfield County Joint Development Authority,204,2094338,6315000,315000,75.095093,3.7458358,2094338,6315000,315000,75.095093,3.7458358
Dalton-Whitfield Economic Development Authority,205,285000,0,0,0,0,285000,0,0,0,0
Dalton-Whitfield Joint Development Authority,206,616250,0,0,0,0,616250,0,0,0,0
Dalton-Whitfield Regional Solid Waste Management Authority,207,66024998,840761,0,1.2573864,0,66025000,840761,0,1.2573864,0
Dawson County Industrial Building Authority,208,1566610,-200000,-200000,-14.634753,-14.634753,1566610,0,0,0,0
Dawson-Terrell County Airport Authority,209,0,0,0,,,0,0,0,,
DeKalb County Building Authority,210,37775836,0,0,0,0,37775836,0,0,0,0
DeKalb County Convention Center Authority,211,0,0,0,,,0,0,0,,
DeKalb County Hospital Authority,212,55085718,0,0,0,0,55085720,0,0,0,0
DeKalb County Public Safety and Judicial Facilities Authority,213,39181203,0,0,0,0,39181204,0,0,0,0
DeKalb Private Hospital Authority,214,1530661.82,0,0,0,0,1530661.9,0,0,0,0
DeKalb Regional Land Bank Authority,215,0,300000,0,100,0,0,300000,0,100,0
Decatur County School Building Authority,216,0,0,0,,,0,0,0,,
Decatur County-Bainbridge Industrial Development Authority,217,0,0,0,,,0,0,0,,
Decatur School Building Authority,218,0,0,0,,,0,0,0,,
Deep South Regional Municipal Solid Waste Management Authority,219,1684666,0,0,0,0,1684666,0,0,0,0
Development Authority for the City of Savannah,220,0,0,0,,,0,0,0,,
Development Authority of Appling County,221,2734976,760000,760000,21.745501,21.745501,2734976,760000,760000,21.745501,21.745501
Development Authority of Atkinson County,222,0,0,0,,,0,0,0,,
Development Authority of Bainbridge and Decatur County,223,2817221.34,0,0,0,0,2817221.3,0,0,0,0
Development Authority of Baker County,224,0,0,0,,,0,0,0,,
Development Authority of Banks County,225,400707,-122689,-122689,-44.129875,-44.129875,400707,0,0,0,0
Development Authority of Bartow County,226,1375948,39930,0,2.8201582,0,1375948,39930,0,2.8201582,0
Development Authority of Ben Hill County,227,198465,0,0,0,0,198465,0,0,0,0
Development Authority of Bibb County,228,1555339,0,0,0,0,1555339,0,0,0,0
"Development Authority of Bowdon, Georgia",229,0,0,0,,,0,0,0,,
"Development Authority of Brooks County, Georgia",230,0,0,0,,,0,0,0,,
Development Authority of Bryan County,231,843463.8000000001,6962316.1875,6464422.17,89.194366,82.815842,843463.81,6962316,6464422,89.194366,82.815842
Development Authority of Bulloch County,232,9844144,7764111,5764111,44.093586,32.735275,9844144,7764111,5764111,44.093586,32.735275
Development Authority of Burke County,233,9170064,480000,0,4.9740601,0,9170064,480000,0,4.9740601,0
Development Authority of Butts County,234,1033821,-17789,-17789,-1.7508307,-1.7508307,1033821,0,0,0,0
Development Authority of Carroll County,235,1720,724614,0,99.763191,0,1720,724614,0,99.763191,0
Development Authority of Cartersville,236,11000,0,0,0,0,11000,0,0,0,0
Development Authority of Catoosa County,237,936576,1419636,1369636,60.250774,58.128727,936576,1419636,1369636,60.250774,58.128727
Development Authority of Chattooga County,238,13503.27,0,0,0,0,13503.27,0,0,0,0
Development Authority of Cherokee County,239,2140269,6797614,5400376,76.053963,60.4212,2140269,6797614,5400376,76.053963,60.4212
Development Authority of Clay County,240,0,0,0,,,0,0,0,,
Development Authority of Clayton County,241,18962499,6975559,6975559,26.893143,26.893143,18962500,6975559,6975559,26.893143,26.893143
Development Authority of Cobb County,242,3139479,0,0,0,0,3139479,0,0,0,0
Development Authority of Columbia County,243,573560,6976608,6976608,92.403351,92.403351,573560,6976608,6976608,92.403351,92.403351
"Development Authority of Columbus, Georgia",244,12964646,8130117,6040117,38.540928,28.633253,12964646,8130117,6040117,38.540928,28.633253
"Development Authority of Conyers, Georgia",245,0,0,0,,,0,0,0,,
Development Authority of Coweta County,246,0,0,0,,,0,0,0,,
Development Authority of Crawford County,247,1470261.21,304367,0,17.15103,0,1470261.3,304367,0,17.15103,0
Development Authority of Crisp County,248,4270.6,0,0,0,0,4270.6001,0,0,0,0
Development Authority of Dawson County,249,18600,1551468,1551468,98.815338,98.815338,18600,1551468,1551468,98.815338,98.815338
Development Authority of DeKalb County,250,5122608.060000001,0,0,0,0,5122608,0,0,0,0
Development Authority of Dougherty County,251,41544,0,0,0,0,41544,0,0,0,0
Development Authority of Douglas County,252,5607310.46,633900,633900,10.156684,10.156684,5607310.5,633900,633900,10.156684,10.156684
Development Authority of Early County,253,67644,482253,0,87.698784,0,67644,482253,0,87.698784,0
Development Authority of Effingham County,254,0,0,0,,,0,0,0,,
"Development Authority of Elbert County, Elberton and Bowman",255,126719,732752,715000,85.256165,83.190704,126719,732752,715000,85.256165,83.190704
Development Authority of Emanuel County,256,33467,0,0,0,0,33467,0,0,0,0
Development Authority of Emanuel County and the City of Swainsboro,257,437048,6355498,6460640,93.565773,95.11367,437048,6355498,6460640,93.565773,95.11367
Development Authority of Fairburn,258,967,0,0,0,0,967,0,0,0,0
Development Authority of Floyd County,259,376196,169872,169872,31.108213,31.108213,376196,169872,169872,31.108213,31.108213
Development Authority of Forsyth County,260,136739.86,90275,49500,39.766121,21.804741,136739.86,90275,49500,39.766121,21.804741
Development Authority of Fulton County,261,15381532,3077650,0,16.672731,0,15381532,3077650,0,16.672731,0
Development Authority of Gilmer County,262,180.99,0,0,0,0,180.99001,0,0,0,0
Development Authority of Gordon County,263,2254975,2394565,1254917,51.501118,26.990133,2254975,2394565,1254917,51.501118,26.990133
Development Authority of Gwinnett County,264,809000,300000,0,27.051397,0,809000,300000,0,27.051397,0
Development Authority of Haralson County,265,3360082,4264005,440278,55.928074,5.7748294,3360082,4264005,440278,55.928074,5.7748294
Development Authority of Harris County,266,49344205,14567751,7902388,22.793468,12.364491,49344204,14567751,7902388,22.793468,12.364491
Development Authority of Heard County,267,2619875.97,799822.515625,171950,23.388685,5.0282211,2619876,799822.5,171950,23.388685,5.0282211
Development Authority of Houston County,268,0,0,0,,,0,0,0,,
Development Authority of Jasper County,269,907337.8000000001,2126235.03125,1194064.02,70.090126,39.361641,907337.81,2126235,1194064,70.090126,39.361641
Development Authority of Jefferson County,270,2282260,2686825,1015000,54.07082,20.426296,2282260,2686825,1015000,54.07082,20.426296
"Development Authority of Jefferson County, Georgia",271,2974344,6600430,4616680,68.935623,48.217117,2974344,6600430,4616680,68.935623,48.217117
"Development Authority of Jefferson, Georgia",272,191911,0,0,0,0,191911,0,0,0,0
