id,totaloprev,revised_nonoprev,fromloc,perc_ownsource,perc_fromloc,pos_op_rev,pos_nonop_rev,pos_fromloc,pos_perc_ownsource,pos_perc_fromloc,p2authname
1036,98515,42385,42385,30.081617,30.081617,98515,42385,42385,30.081617,30.081617,Terrell County Airport Authority
1037,18000,0,0,0,0,18000,0,0,0,0,Terrell County Development Authority
1039,25417835,0,0,0,0,25417836,0,0,0,0,The Atlanta Development Authority d/b/a Invest Atlanta
1040,103823126,0,0,0,0,103823128,0,0,0,0,The Baxley and Appling County Hospital Authority
1043,226008.78,0,0,0,0,226008.78,0,0,0,0,The Commerce Civic Center and Tourism Authority
1044,230157,426606,0,64.955849,0,230157,426606,0,64.955849,0,The Commerce Housing Authority
1046,11000,0,0,0,0,11000,0,0,0,0,The Development Authority of Long County
1047,317830,0,0,0,0,317830,0,0,0,0,The Development Authority of Pickens County
1048,0,0,0,,,0,0,0,,,"The Development Authority of Snellville, Georgia"
1049,534923,0,0,0,0,534923,0,0,0,0,The Development Authority of the City of Camilla
1050,770383,540933,540933,41.251156,41.251156,770383,540933,540933,41.251156,41.251156,The Development Authority of the City of Manchester
1052,229940.47,0,0,0,0,229940.47,0,0,0,0,"The Downtown Development Authority of Bainbridge, Georgia"
1053,0,0,0,,,0,0,0,,,"The Downtown Development Authority of the City of Griffin, Georgia"
1054,2551.79,18584,0,87.926689,0,2551.79,18584,0,87.926689,0,"The Downtown Development Authority of the City of Manchester, Georgia"
1055,763765000,41103000,0,5.1068001,0,763764992,41103000,0,5.1068001,0,The Fulton-DeKalb Hospital Authority
1056,182059070,1898090,1898090,1.0318109,1.0318109,182059072,1898090,1898090,1.0318109,1.0318109,The Hospital Authority of Habersham County
1057,0,0,0,,,0,0,0,,,The Hospital Authority of Hall County and the City of Gainesville
1059,7949925,21202631,0,72.729919,0,7949925,21202632,0,72.729919,0,"The Housing Authority of the City of Americus, GA"
1060,866092705,52045713,0,5.668613,0,866092736,52045712,0,5.6686125,0,"The Housing Authority of the City of Atlanta, Georgia"
1061,4191080,33804602,0,88.969589,0,4191080,33804600,0,88.969589,0,"The Housing Authority of the City of Brunswick, Georgia"
1062,1324675,2551526,0,65.825432,0,1324675,2551526,0,65.825432,0,"The Housing Authority of the City of Dallas, Georgia"
1063,10845405,7605709,0,41.220867,0,10845405,7605709,0,41.220867,0,The Housing Authority of the City of Newnan
1064,554964,1068673,0,65.819702,0,554964,1068673,0,65.819702,0,The Housing Authority of the City of Washington
1065,0,0,0,,,0,0,0,,,The Joint Development Authority of Cherokee County and Cobb County
1066,64358510,0,0,0,0,64358512,0,0,0,0,The Medical Center Hospital Authority
1067,1010727,21,0,.0020776691,0,1010727,21,0,.0020776691,0,The Northwest Georgia Joint Development Authority
1068,0,0,0,,,0,0,0,,,The Pierce County Hospital Authority
1069,20024,121801,121801,85.881195,85.881195,20024,121801,121801,85.881195,85.881195,The Winder Downtown Development Authority
1070,0,0,0,,,0,0,0,,,Thomaston Downtown Development Authority
1071,3962019,1785629,424792,31.067125,7.3907099,3962019,1785629,424792,31.067125,7.3907099,Thomaston-Upson County Airport Authority
1072,125812,1690490,1690490,93.073181,93.073181,125812,1690490,1690490,93.073181,93.073181,Thomaston-Upson County Industrial Development Authority
1073,10447821,0,0,0,0,10447821,0,0,0,0,Thomaston-Upson County Office Building Authority
1074,1158040,0,0,0,0,1158040,0,0,0,0,Thomasville Convention and Visitors Bureau
1076,576618,0,0,0,0,576618,0,0,0,0,Thomasville Payroll Development Authority
1077,22098956,406000,0,1.8040471,0,22098956,406000,0,1.8040471,0,Tift County Development Authority
1078,1112748000,231000,0,.020755108,0,1112748032,231000,0,.020755108,0,Tift County Hospital Authority
1080,0,0,0,,,0,0,0,,,Tift-Turner-Worth-Cook Joint Development Authority
1081,228382,875094,315287,79.303398,28.572166,228382,875094,315287,79.303398,28.572166,Tifton-Tift County Airport Authority
1082,266780,880887,208245,76.754578,18.145071,266780,880887,208245,76.754578,18.145071,Toccoa/Stephens County Airport Authority
1083,0,3182104.25,2682104.26,100,84.287125,0,3182104.3,2682104.3,100,84.287125,Toombs County Development Authority
1084,496162332,0,0,0,0,496162336,0,0,0,0,Toombs County Hospital Authority
1086,6058894,186976,0,2.9935942,0,6058894,186976,0,2.9935942,0,Towns County Water and Sewerage Authority
1087,243792,160000,160000,39.624363,39.624363,243792,160000,160000,39.624363,39.624363,Treutlen County Development Authority
1088,632346,0,0,0,0,632346,0,0,0,0,Treutlen County Hospital Authority
1089,61719,873197,0,93.398445,0,61719,873197,0,93.398445,0,Tri-City Housing Authority
1091,2770582,0,0,0,0,2770582,0,0,0,0,Tri-County Joint E-911 Development Authority
1092,3878527,0,0,0,0,3878527,0,0,0,0,Troup County Airport Authority
1093,422058,0,0,0,0,422058,0,0,0,0,Troup County Development  Authority
1094,0,0,0,,,0,0,0,,,Troup County Public Facilities Authority
1095,0,420000,0,100,0,0,420000,0,100,0,Troup Family Connection Authority
1096,363559,37500,37500,9.3502455,9.3502455,363559,37500,37500,9.3502455,9.3502455,Turner County Development Authority
1097,321838,0,0,0,0,321838,0,0,0,0,Union City Housing Authority
1099,28045637,0,0,0,0,28045636,0,0,0,0,Upper Oconee Basin Water Authority
1100,405980,0,0,0,0,405980,0,0,0,0,Urban Redevelopment Agency of Augusta
1102,2960054,0,0,0,0,2960054,0,0,0,0,"Urban Redevelopment Agency of DeKalb County, Georgia"
1103,0,0,0,,,0,0,0,,,"Urban Redevelopment Agency of Union County, Ga"
1104,0,0,0,,,0,0,0,,,Urban Redevelopment Agency of the City of Canton
1105,0,0,0,,,0,0,0,,,Urban Redevelopment Agency of the City of Dallas
1106,228364.89,681655,0,74.905502,0,228364.89,681655,0,74.905502,0,Urban Redevelopment Agency of the City of Decatur
1107,0,0,0,,,0,0,0,,,Urban Redevelopment Agency of the City of Duluth
1108,0,587715,587715,100,100,0,587715,587715,100,100,Urban Redevelopment Agency of the City of Dunwoody
1109,22093933,0,0,0,0,22093932,0,0,0,0,Urban Redevelopment Agency of the City of Forest Park
1110,0,0,0,,,0,0,0,,,"Urban Redevelopment Agency of the City of Kennesaw, Georgia"
1111,0,0,0,,,0,0,0,,,"Urban Redevelopment Agency of the City of Morrow, Georgia"
1112,20072,0,0,0,0,20072,0,0,0,0,Urban Redevelopment Agency of the City of Snellville
1113,197,0,0,0,0,197,0,0,0,0,Urban Redevelopment Agency of the City of Stockbridge
1114,0,0,0,,,0,0,0,,,Urban Redevelopment Agency of the Town of Braselton
1115,0,0,0,,,0,0,0,,,Urban Redevelopment Authority of the City of Suwanee
1116,27112538,0,0,0,0,27112538,0,0,0,0,"Urban Residential Finance Authority of the City of Atlanta, Georgia"
1117,11425430,0,0,0,0,11425430,0,0,0,0,Valdosta Housing Authority
1118,4591700,1996071,0,30.299641,0,4591700,1996071,0,30.299641,0,Valdosta-Lowndes County Airport Authority
1119,12353119,0,0,0,0,12353119,0,0,0,0,Valdosta-Lowndes County Industrial Authority
1120,0,0,0,,,0,0,0,,,Valdosta-Lowndes County Land Bank Authority
1121,1141866.65,0,0,0,0,1141866.6,0,0,0,0,Valley Partnership Joint Development Authority
1122,60000,0,0,0,0,60000,0,0,0,0,Vidalia Development Authority
1123,87750,0,0,0,0,87750,0,0,0,0,Villa Rica Development Authority
1124,24998,0,0,0,0,24998,0,0,0,0,Villa Rica Downtown Development Authority
1125,1298809,0,0,0,0,1298809,0,0,0,0,Walker County Development Authority
1126,2123723,0,0,0,0,2123723,0,0,0,0,Walker County Rural Water and Sewer Authority
1127,20445136,0,0,0,0,20445136,0,0,0,0,Walker County Water and Sewerage Authority
1128,0,0,0,,,0,0,0,,,Walton County Hospital Authority
1129,0,0,0,,,0,0,0,,,Walton County Water and Sewerage Authority
1130,0,0,0,,,0,0,0,,,Walton Industrial Building Authority
1131,1198712,0,0,0,0,1198712,0,0,0,0,Warner Robins Building Authority
1132,0,0,0,,,0,0,0,,,Warner Robins Public Facilities Authority
1133,287210,136879,136879,32.276009,32.276009,287210,136879,136879,32.276009,32.276009,Washington County Airport Authority
1134,712855,278463,278463,28.090179,28.090179,712855,278463,278463,28.090179,28.090179,Washington County Public Facilities Authority
1135,1579462,201421,201421,11.310176,11.310176,1579462,201421,201421,11.310176,11.310176,Washington-Wilkes Payroll Development Authority
1136,3705,216574,216574,98.318039,98.318039,3705,216574,216574,98.318039,98.318039,Waycross and Ware County Development Authority
1138,0,0,0,,,0,0,0,,,Wayne County Solid Waste Management Authority
1140,633359,314786,314786,33.200195,33.200195,633359,314786,314786,33.200195,33.200195,Waynesboro-Burke County Hospital Authority
1141,0,0,0,,,0,0,0,,,Webster County Industrial Development Authority
1142,0,0,0,,,0,0,0,,,West Central Georgia Broadband Joint Development Authority
1143,0,0,0,,,0,0,0,,,West Central Georgia Joint Development Authority
1144,662958,1251051,0,65.362862,0,662958,1251051,0,65.362862,0,West Georgia Airport Authority
1145,0,0,0,,,0,0,0,,,West Georgia Joint Development Authority
1147,800625,0,0,0,0,800625,0,0,0,0,West Point Development Authority
1149,0,0,0,,,0,0,0,,,West Point Lake Development Authority
1150,0,0,0,,,0,0,0,,,White County Building Authority
1151,0,0,0,,,0,0,0,,,White County Industrial Building Authority
1152,4816498,0,0,0,0,4816498,0,0,0,0,White County Water and Sewerage Authority
1153,0,0,0,,,0,0,0,,,Wilcox County Industrial Development Authority
1155,92949.27,0,0,0,0,92949.273,0,0,0,0,Winder-Barrow Industrial Building Authority
1156,0,0,0,,,0,0,0,,,Woodbine Downtown Development Authority
1158,134495.5,19761.76953125,19761.77,12.810916,12.810917,134495.5,19761.77,19761.77,12.810916,12.810916,Woodstock Area Convention and Visitors Bureau Authority
1159,56,0,0,0,0,56,0,0,0,0,Woodstock Urban Redevelopment Agency
1160,1455067,0,0,0,0,1455067,0,0,0,0,Worth County Economic Development Authority
