id,totaloprev,revised_nonoprev,fromloc,perc_ownsource,perc_fromloc,pos_op_rev,pos_nonop_rev,pos_fromloc,pos_perc_ownsource,pos_perc_fromloc,p2authname
688,835110,126724,0,13.175246,0,835110,126724,0,13.175246,0,Housing Authority of the City of Ellaville
689,670019,570748,0,45.999611,0,670019,570748,0,45.999611,0,"Housing Authority of the City of Ellijay, Georgia"
690,882034,3100342,0,77.851563,0,882034,3100342,0,77.851563,0,Housing Authority of the City of Fitzgerald
692,292358,385005,0,56.838799,0,292358,385005,0,56.838799,0,Housing Authority of the City of Fort Gaines
694,4352786,5231655,0,54.584873,0,4352786,5231655,0,54.584873,0,Housing Authority of the City of Gainesville
695,249163,753945,0,75.160896,0,249163,753945,0,75.160896,0,Housing Authority of the City of Glennville
696,88193,0,0,0,0,88193,0,0,0,0,Housing Authority of the City of Glenwood
697,276052,251757,0,47.698505,0,276052,251757,0,47.698505,0,Housing Authority of the City of Grantville
698,1129854,1107058,0,49.490459,0,1129854,1107058,0,49.490459,0,"Housing Authority of the City of Greensboro, Georgia"
699,874861,3965428,0,81.925438,0,874861,3965428,0,81.925438,0,Housing Authority of the City of Griffin
700,90243,231332,0,71.937187,0,90243,231332,0,71.937187,0,"Housing Authority of the City of Hahira, Georgia"
702,977313,1571597,0,61.657612,0,977313,1571597,0,61.657612,0,Housing Authority of the City of Hartwell
703,2921453,2346747,0,44.545517,0,2921453,2346747,0,44.545517,0,"Housing Authority of the City of Hinesville, Ga"
704,1034376,1113947,0,51.851933,0,1034376,1113947,0,51.851933,0,Housing Authority of the City of Hogansville
706,983006,1354283,0,57.942471,0,983006,1354283,0,57.942471,0,Housing Authority of the City of Jasper
707,613982,1097734,0,64.130615,0,613982,1097734,0,64.130615,0,Housing Authority of the City of Jefferson
708,565551,2097473,0,78.762825,0,565551,2097473,0,78.762825,0,Housing Authority of the City of Jesup
709,71238,333743,0,82.409546,0,71238,333743,0,82.409546,0,"Housing Authority of the City of Lakeland, Georgia"
710,1156103,2781684,0,70.640793,0,1156103,2781684,0,70.640793,0,Housing Authority of the City of Lavonia
711,2031255,2164015,35000,51.582256,.83427286,2031255,2164015,35000,51.582256,.83427286,"Housing Authority of the City of Lawrenceville, GA"
712,953888,2064538,0,68.397835,0,953888,2064538,0,68.397835,0,"Housing Authority of the City of Lithonia, Georgia"
713,85569,301739,0,77.906731,0,85569,301739,0,77.906731,0,"Housing Authority of the City of Loganville, GA"
714,572078,0,0,0,0,572078,0,0,0,0,Housing Authority of the City of Louisville
715,159279814,3638313,0,2.2332156,0,159279808,3638313,0,2.2332156,0,"Housing Authority of the City of Macon, Georgia"
716,107973,820794,0,88.374588,0,107973,820794,0,88.374588,0,"Housing Authority of the City of Madison, GA"
717,49496467,898947,0,1.7837874,0,49496468,898947,0,1.7837873,0,Housing Authority of the City of Marietta
718,153474,219143,0,58.811863,0,153474,219143,0,58.811863,0,Housing Authority of the City of McCaysville Georgia
719,1497973,0,0,0,0,1497973,0,0,0,0,Housing Authority of the City of McDonough
720,940306,339898,0,26.550301,0,940306,339898,0,26.550301,0,"Housing Authority of the City of Menlo, Georgia"
721,681115,2009741,0,74.687798,0,681115,2009741,0,74.687798,0,Housing Authority of the City of Metter
723,407661,0,0,0,0,407661,0,0,0,0,Housing Authority of the City of Millen
724,1420030,6456525,0,81.971436,0,1420030,6456525,0,81.971436,0,"Housing Authority of the City of Monroe, GA"
725,278810,707616,0,71.735336,0,278810,707616,0,71.735336,0,Housing Authority of the City of Monticello
727,101664,491966,0,82.874184,0,101664,491966,0,82.874184,0,Housing Authority of the City of Mt. Vernon
728,196355,419859,0,68.135262,0,196355,419859,0,68.135262,0,Housing Authority of the City of Nahunta
729,944968,1966073,0,67.538483,0,944968,1966073,0,67.538483,0,"Housing Authority of the City of Nashville, Georgia"
730,0,0,0,,,0,0,0,,,"Housing Authority of the City of Oakwood, Georgia"
731,1035141,2816139,0,73.122154,0,1035141,2816139,0,73.122154,0,"Housing Authority of the City of Ocilla, Ga"
732,105639,225960,0,68.142548,0,105639,225960,0,68.142548,0,"Housing Authority of the City of Pearson, Georgia"
733,240722,615758,0,71.894028,0,240722,615758,0,71.894028,0,"Housing Authority of the City of Perry, Georgia"
734,1145874,1702551,0,59.771664,0,1145874,1702551,0,59.771664,0,Housing Authority of the City of Quitman
739,1655213,0,0,0,0,1655213,0,0,0,0,Housing Authority of the City of Roswell
740,842716,2139902,0,71.745758,0,842716,2139902,0,71.745758,0,Housing Authority of the City of Royston
741,826254,1311998,0,61.358437,0,826254,1311998,0,61.358437,0,Housing Authority of the City of Sandersville
742,729425,0,0,0,0,729425,0,0,0,0,Housing Authority of the City of Senoia
743,139545,385526,0,73.423592,0,139545,385526,0,73.423592,0,Housing Authority of the City of Shellman
744,290318,946040,0,76.518288,0,290318,946040,0,76.518288,0,"Housing Authority of the City of Social Circle, GA"
746,804158,2521455,0,75.819252,0,804158,2521455,0,75.819252,0,Housing Authority of the City of Statesboro
747,13013.35,0,0,0,0,13013.35,0,0,0,0,"Housing Authority of the City of Sugar Hill, Georgia"
750,873803,0,0,0,0,873803,0,0,0,0,Housing Authority of the City of Sylvania
751,1873182,1662462,0,47.020061,0,1873182,1662462,0,47.020061,0,"Housing Authority of the City of Tallapoosa, Georgia"
752,3543137,4083820,0,53.544552,0,3543137,4083820,0,53.544552,0,Housing Authority of the City of Thomaston
757,457399,1587546,0,77.632698,0,457399,1587546,0,77.632698,0,Housing Authority of the City of Vidalia
758,1579402,421709,0,21.073744,0,1579402,421709,0,21.073744,0,Housing Authority of the City of Vienna
760,5865883,0,0,0,0,5865883,0,0,0,0,"Housing Authority of the City of Warner Robins, Georgia"
762,1578145,4562780,0,74.301186,0,1578145,4562780,0,74.301186,0,Housing Authority of the City of Waycross
763,5321981,0,0,0,0,5321981,0,0,0,0,Housing Authority of the City of Waynesboro
764,7002307,1238199,0,15.025764,0,7002307,1238199,0,15.025764,0,Housing Authority of the City of West Point
765,6285688,2384955,0,27.506092,0,6285688,2384955,0,27.506092,0,Housing Authority of the City of Winder
767,568759,659682,0,53.700748,0,568759,659682,0,53.700748,0,Housing Authority of the City of Wrightsville
768,74272,216929,0,74.494591,0,74272,216929,0,74.494591,0,"Housing Authority of the County of Atkinson, Georgia"
769,140013006,124094904,4707543,46.986439,1.7824316,140013008,124094904,4707543,46.986439,1.7824316,"Housing Authority of the County of DeKalb, Georgia"
770,755117,196779,0,20.672321,0,755117,196779,0,20.672321,0,Housing Authority of the County of Harris
773,310931,4696787,4496787,93.790962,89.797127,310931,4696787,4496787,93.790962,89.797127,Houston County Development Authority
774,0,0,0,,,0,0,0,,,Ideal Downtown Development Authority
776,23933,0,0,0,0,23933,0,0,0,0,Industrial Development Authority of Butts County
777,0,0,0,,,0,0,0,,,Industrial Development Authority of the City of Buford
778,1537556,2664859,837906,63.412563,19.938679,1537556,2664859,837906,63.412563,19.938679,Jackson County Airport Authority
779,431879,7300,7300,1.6621925,1.6621925,431879,7300,7300,1.6621925,1.6621925,Jackson County Industrial Development Authority
780,27147363,8581166,8281166,24.017687,23.17802,27147364,8581166,8281166,24.017685,23.17802,Jackson County Water and Sewage Authority
781,1174488,1557015,0,57.002132,0,1174488,1557015,0,57.002132,0,Jackson Housing Authority
783,667992,0,0,0,0,667992,0,0,0,0,Jasper County Water and Sewer Authority
784,144527,598500,0,80.548889,0,144527,598500,0,80.548889,0,Jenkins County Development Authority
786,54197,208000,208000,79.329666,79.329666,54197,208000,208000,79.329666,79.329666,Join Development Authority of Mitchell County and Pelham
787,0,0,0,,,0,0,0,,,Joint Cartersville-Bartow County Regional Industrial Development Authority
789,0,355535,0,100,0,0,355535,0,100,0,"Joint Development Authority of Banks, Habersham and Rabun Counties"
790,0,0,0,,,0,0,0,,,Joint Development Authority of Bartow County and Pickens County
791,-627722,0,0,0,0,0,0,0,,,"Joint Development Authority of Brooks, Colquitt, Grady, Mitchell, and Thomas Counties"
792,0,0,0,,,0,0,0,,,Joint Development Authority of Burke County and City of Waynesboro
793,24323,0,0,0,0,24323,0,0,0,0,"Joint Development Authority of Carroll, Haralson, Polk, Heard and Troup Counties"
794,64045,0,0,0,0,64045,0,0,0,0,"Joint Development Authority of Colquitt, Mitchell, Grady, Thomas and Brooks Counties"
795,0,0,0,,,0,0,0,,,"Joint Development Authority of Dawson, Lumpkin and White Counties"
796,0,0,0,,,0,0,0,,,"Joint Development Authority of Dekalb County, Newton County, and Gwinnett County"
797,0,0,0,,,0,0,0,,,"Joint Development Authority of Fannin County, Towns County and Union County"
798,0,1416627,83866,100,5.9201188,0,1416627,83866,100,5.9201188,"Joint Development Authority of Franklin, Hart and Stephens Counties"
799,0,0,0,,,0,0,0,,,Joint Development Authority of Gilmer County and Pickens County
800,48250,0,0,0,0,48250,0,0,0,0,"Joint Development Authority of Hazlehurst, Lumber City and Telfair County"
801,1037170,0,0,0,0,1037170,0,0,0,0,"Joint Development Authority of Jasper County, Morgan County, Newton County, and Walton County"
802,5766872,430902,430902,6.9525285,6.9525285,5766872,430902,430902,6.9525285,6.9525285,"Joint Development Authority of Jeff Davis County, Hazlehurst and Denton, Georgia"
803,171160,1500000,0,89.758011,0,171160,1500000,0,89.758011,0,Joint Development Authority of Meriwether County and the City of Hogansville
804,64000,0,0,0,0,64000,0,0,0,0,Joint Development Authority of Metropolitan Atlanta
805,0,0,0,,,0,0,0,,,Joint Development Authority of Northeast Georgia
806,36938.62,0,0,0,0,36938.621,0,0,0,0,Joint Development Authority of Winder-Barrow County
807,1091309,513680,249422,32.005203,15.540418,1091309,513680,249422,32.005203,15.540418,Joint Grady County Development Authority
808,23544515,0,0,0,0,23544516,0,0,0,0,"Joint Public Safety and Judicial Facilities Authority for the Cities of Sandy Springs, Georgia and J"
809,1185629,0,0,0,0,1185629,0,0,0,0,Kennesaw Development Authority
810,103642,0,0,0,0,103642,0,0,0,0,Kennesaw Downtown Development Authority
811,1381803.34,0,0,0,0,1381803.4,0,0,0,0,Kingsland Area Tourism Authority
812,523731.0600000001,0,0,0,0,523731.06,0,0,0,0,Kingsland Development Authority
813,34918.08,0,0,0,0,34918.078,0,0,0,0,Kingsland Downtown Development Authority
814,0,0,0,,,0,0,0,,,Kingston Downtown Development Authority
817,6019506,4637017,4012017,43.513412,37.64846,6019506,4637017,4012017,43.513412,37.64846,LaGrange Development Authority
818,664776214,39590,0,.005955033,0,664776192,39590,0,.005955033,0,LaGrange-Troup County Hospital Authority
819,0,0,0,,,0,0,0,,,Lake Allatoona Preservation Authority
820,0,0,0,,,0,0,0,,,Lake Oconee Area Development Authority
822,7551544,326612,404,4.1457925,.0051281038,7551544,326612,404,4.1457925,.0051281038,Lamar County Regional Solid Waste Authority
824,0,0,0,,,0,0,0,,,Lanier Joint Development Authority
825,0,0,0,,,0,0,0,,,Laurens County Public Facilities Authority
826,5839136,37310,0,.63490754,0,5839136,37310,0,.63490754,0,Laurens County Solid Waste Management Authority
827,0,0,0,,,0,0,0,,,Laurens-Treutlen Joint Development Authority
828,107770,0,0,0,0,107770,0,0,0,0,Lavonia Downtown Development Authority
829,13659162,0,0,0,0,13659162,0,0,0,0,Lee County Utilities Authority
830,0,0,0,,,0,0,0,,,Liberty County Fire Authority
831,18159748,3158272,0,14.815035,0,18159748,3158272,0,14.815035,0,Liberty County Industrial Authority
833,0,0,0,,,0,0,0,,,Liberty County Public Facilities Authority
834,2747007,0,0,0,0,2747007,0,0,0,0,Liberty County Solid Waste Authority
835,74769.39,0,0,0,0,74769.391,0,0,0,0,Lilburn Downtown Development Authority
836,1900457.74,1214.77001953125,0,.063879035,0,1900457.8,1214.77,0,.063879035,0,Lincoln County Development Authority
837,16,0,0,0,0,16,0,0,0,0,Lincoln County Recreation Authority
838,0,0,0,,,0,0,0,,,Lithonia Downtown Development Authority
839,0,0,0,,,0,0,0,,,Loganville Development Authority
841,7929,138592,16325,94.588486,11.141747,7929,138592,16325,94.588486,11.141747,Lower Chattahoochee Regional Airport Authority
842,1385659,0,0,0,0,1385659,0,0,0,0,Lower Chattahoochee Regional E-911 Authority
843,12000,512778,0,97.713318,0,12000,512778,0,97.713318,0,Lower Chattahoochee Regional Transportation Authority
844,0,0,0,,,0,0,0,,,Lowndes County Public Facilities Authority
846,0,0,0,,,0,0,0,,,Lumpkin County Public Building Authority
847,4149979,0,0,0,0,4149979,0,0,0,0,Lumpkin County Water & Sewerage Authority
850,134719862,3812327,0,2.7519431,0,134719856,3812327,0,2.7519431,0,Macon Water Authority
851,21265000,0,0,0,0,21265000,0,0,0,0,Macon-Bibb County Hospital Authority
852,3932712,5432358,4438091,58.006592,47.389832,3932712,5432358,4438091,58.006592,47.389832,Macon-Bibb County Industrial Authority
854,554148,3823709,3823709,87.342026,87.342026,554148,3823709,3823709,87.342026,87.342026,Macon-Bibb County Urban Development Authority
855,2443002,1544386,563420,38.73177,14.130052,2443002,1544386,563420,38.73177,14.130052,Madison County Industrial Development and Building Authority
856,0,0,0,,,0,0,0,,,Madison-Morgan County Airport Authority
857,262840,426911,426911,61.893494,61.893494,262840,426911,426911,61.893494,61.893494,Main Street Dublin-The Downtown Development Authority of Dublin
858,0,0,0,,,0,0,0,,,Manchester Public Utilities Authority
861,0,0,0,,,0,0,0,,,McDuffie County Hospital Authority
862,2791350,708848,0,20.251654,0,2791350,708848,0,20.251654,0,McIntosh County Industrial Development Authority
863,0,3571928,818402,100,22.912052,0,3571928,818402,100,22.912052,McPherson Local Implementing Redevelopment Authority
864,35,0,0,0,0,35,0,0,0,0,Meriwether County Hospital Authority
865,2858311,609142,0,17.567419,0,2858311,609142,0,17.567419,0,Meriwether County Industrial Development Authority
866,0,0,0,,,0,0,0,,,Meriwether County Public Facilities Authority
867,2018760,0,0,0,0,2018760,0,0,0,0,Meriwether County Water and Sewerage Authority
868,447994,293197,0,39.557549,0,447994,293197,0,39.557549,0,Metropolitan Atlanta Rapid Transit Authority
869,238244,393490,35550,62.287292,5.6273685,238244,393490,35550,62.287292,5.6273685,Metter-Candler County Airport Authority
870,42334,0,0,0,0,42334,0,0,0,0,Middle Coastal Unified Development Authority
871,5285843,0,0,0,0,5285843,0,0,0,0,Middle Flint Regional E-911 Authority
875,0,0,0,,,0,0,0,,,Milledgeville MainStreet/The Downtown Development Authority of the City of Milledgeville
876,144720,0,0,0,0,144720,0,0,0,0,Miller County Development Authority
877,0,600000,0,100,0,0,600000,0,100,0,Mitchell County Development Authority
879,0,0,0,,,0,0,0,,,Monroe County Industrial Development Authority
881,4200,9400,0,69.117645,0,4200,9400,0,69.117645,0,Montezuma Downtown Development Authority
883,0,0,0,,,0,0,0,,,Morgan County Building Authority
884,51616000,2780000,2780000,5.1106701,5.1106701,51616000,2780000,2780000,5.1106701,5.1106701,Morgan County Hospital Authority
885,0,0,0,,,0,0,0,,,Morgan County Water Authority
886,0,82000,82000,100,100,0,82000,82000,100,100,Morrow Housing Authority
887,-68182,96481,0,340.9343,0,0,96481,0,100,0,Moultrie-Colquitt County Development Authority
888,595879,0,0,0,0,595879,0,0,0,0,Murray County Hospital Authority
889,0,0,0,,,0,0,0,,,Murray County Industrial Development Authority
891,0,0,0,,,0,0,0,,,Nashville Downtown Development Authority
893,860831.74,0,0,0,0,860831.75,0,0,0,0,Newnan Convention Center Authority
894,4379286,2955196,1221115,40.291817,16.64896,4379286,2955196,1221115,40.291817,16.64896,Newnan-Coweta County Airport Authority
895,315676000,0,0,0,0,315676000,0,0,0,0,Newton County Hospital Authority
896,77206,175000,0,69.387726,0,77206,175000,0,69.387726,0,Newton County Industrial Development Authority
897,5991561,0,0,0,0,5991561,0,0,0,0,Newton County Solid Waste Authority
898,55912421,926587,0,1.6301956,0,55912420,926587,0,1.6301956,0,Newton County Water and Sewerage Authority
899,1235635,0,0,0,0,1235635,0,0,0,0,Nicholson Water Authority
900,0,0,0,,,0,0,0,,,Norcross Development Authority
901,0,300000,300000,100,100,0,300000,300000,100,100,North Fulton Regional Radio System Authority
902,203839,333970,333520,62.098255,62.01458,203839,333970,333520,62.098255,62.01458,North Georgia Solid Waste Management Authority
904,0,0,0,,,0,0,0,,,Northeast Georgia Regional Solid Waste Management Authority
905,8362977.73,38236899.5,422481,82.05365,.90661401,8362977.5,38236900,422481,82.05365,.90661395,Northwest Georgia Housing Authority
907,5355275,0,0,0,0,5355275,0,0,0,0,Notla Water System
908,31731,0,0,0,0,31731,0,0,0,0,Oak Grove Cemetery Authority
909,15557,835770,823854,98.172615,96.772919,15557,835770,823854,98.172615,96.772919,Ocilla-Irwin County Industrial Development Authority
910,527555,18650001,0,97.2491,0,527555,18650000,0,97.2491,0,Oconee County Industrial Development Authority
913,4256,205424,205424,97.970238,97.970238,4256,205424,205424,97.970238,97.970238,Okefenokee Area Development Authority
914,373725,0,0,0,0,373725,0,0,0,0,Palmetto Housing Authority
915,1172391,3673338,3673338,75.805687,75.805687,1172391,3673338,3673338,75.805687,75.805687,Paulding County Airport Authority
916,0,0,0,,,0,0,0,,,Paulding County Hospital Authority
917,1137862,0,0,0,0,1137862,0,0,0,0,Paulding County Industrial Building Authority
920,7772477,4844958,0,38.398914,0,7772477,4844958,0,38.398914,0,Peachtree City Airport Authority
921,27257902,0,0,0,0,27257902,0,0,0,0,Peachtree City Water and Sewerage Authority
922,1786254,2480560,0,58.136116,0,1786254,2480560,0,58.136116,0,Pelham Housing Authority
923,19200,0,0,0,0,19200,0,0,0,0,Perkins Water Authority
924,1390438,0,0,0,0,1390438,0,0,0,0,Perry Area Convention and Visitors Bureau Authority
925,2081983,1427723,444732,40.679276,12.671489,2081983,1427723,444732,40.679276,12.671489,Perry-Houston County Airport Authority
926,0,0,0,,,0,0,0,,,Pickens County Airport Authority
928,20500,120000,120000,85.409256,85.409256,20500,120000,120000,85.409256,85.409256,Pierce County Industrial Development and Building Authority
930,0,0,0,,,0,0,0,,,Pike County Arts Facility Authority
931,537089,1073353,1073353,66.64959,66.64959,537089,1073353,1073353,66.64959,66.64959,Pike County Recreation Authority
932,392694,642175,565104,62.053749,54.606331,392694,642175,565104,62.053749,54.606331,Pike County Water and Sewerage Authority
934,7861398,0,0,0,0,7861398,0,0,0,0,"Polk County Water, Sewage and Solid Waste Authority"
935,163793.25,0,0,0,0,163793.25,0,0,0,0,Pooler Development Authority
937,30,0,0,0,0,30,0,0,0,0,Powder Springs Downtown Development Authority
938,0,0,0,,,0,0,0,,,Pulaski County Hospital Authority
939,0,0,0,,,0,0,0,,,Pulaski County School Building Authority
940,26457758,0,0,0,0,26457758,0,0,0,0,Pulaski County-Hawkinsville Development Authority
941,4,0,0,0,0,4,0,0,0,0,Pulaski-Wilcox County Regional Jail Authority
942,136516.76,500019.58984375,29106.39,78.553185,4.5726204,136516.77,500019.59,29106.391,78.553185,4.5726204,Putnam Development Authority
943,0,0,0,,,0,0,0,,,Quitman County Development Authority
944,0,0,0,,,0,0,0,,,Quitman Urban Redevelopment Authority
945,33500,1088368,18242,97.013908,1.626038,33500,1088368,18242,97.013908,1.626038,Quitman-Brooks County Airport Authority
946,0,0,0,,,0,0,0,,,Rabun County Building Authority
947,266608.35,27148.76953125,27148.77,9.24191,9.2419109,266608.34,27148.77,27148.77,9.2419109,9.2419109,Rabun County Convention and Visitors Bureau Authority
948,0,0,0,,,0,0,0,,,Rabun County Economic Development Authority
949,0,0,0,,,0,0,0,,,Rabun County Hospital Authority
950,0,129000,129000,100,100,0,129000,129000,100,100,Rabun County Water and Sewer Authority
951,138558,19081,19081,12.104239,12.104239,138558,19081,19081,12.104239,12.104239,Randolph County Development Authority
953,147015.83,11243.7001953125,0,7.1045961,0,147015.83,11243.7,0,7.1045961,0,Reidsville Airport Authority
955,0,0,0,,,0,0,0,,,Residential Care Facilities For The Elderly Authority of Columbia County
956,0,0,0,,,0,0,0,,,Residential Care Facilities for the Elderly Authority of Athens-Clarke County
957,66441,0,0,0,0,66441,0,0,0,0,Residential Care Facilities for the Elderly Authority of DeKalb County
958,26737,0,0,0,0,26737,0,0,0,0,Residential Care Facilities for the Elderly Authority of Fulton County
960,0,0,0,,,0,0,0,,,"Residential Care Facilities for the Elderly Authority of Lowndes County, Georgia"
961,0,0,0,,,0,0,0,,,Residential Care Facilities for the Elderly Authority of Whitfield County
962,0,0,0,,,0,0,0,,,Residential Care Facilities for the Elderly of Coweta County
963,0,0,0,,,0,0,0,,,Resource Recovery Development Authority for the City of Savannah
964,0,0,0,,,0,0,0,,,Resource Recovery Development Authority of Bartow County
965,0,4872882.1875,4872882.17,100,100,0,4872882,4872882,100,100,Resource Recovery Development Authority of Cherokee County
966,0,0,0,,,0,0,0,,,"Resource Recovery Development Authority of Columbus, Ga"
967,15372351,0,0,0,0,15372351,0,0,0,0,Richmond County Hospital Authority
968,629301,0,0,0,0,629301,0,0,0,0,Richmond Hill Convention and Visitors Bureau
970,65106,196359,0,75.099533,0,65106,196359,0,75.099533,0,Rochelle Housing Authority
971,0,0,0,,,0,0,0,,,Rockdale County Water and Sewerage Authority
972,17105,0,0,0,0,17105,0,0,0,0,Rockmart Development Authority
973,689255,525000,525000,43.236389,43.236389,689255,525000,525000,43.236389,43.236389,Rome-Floyd County Development Authority
974,0,0,0,,,0,0,0,,,Rome-Floyd County Land Bank Authority
975,6000,18000,18000,75,75,6000,18000,18000,75,75,Sandersville Downtown Development Authority
977,12720996,0,0,0,0,12720996,0,0,0,0,Satilla Regional Water and Sewer Authority
978,18926517,0,0,0,0,18926516,0,0,0,0,Savannah Economic Development Authority
979,1830.44,0,0,0,0,1830.4399,0,0,0,0,Schley-Sumter-Macon Counties Joint Development Authority
980,14143,1241984,1234091,98.874077,98.24572,14143,1241984,1234091,98.874077,98.24572,Screven County Development Authority
982,0,0,0,,,0,0,0,,,Screven County Public Facilities Authority
983,8219846.630000001,0,0,0,0,8219846.5,0,0,0,0,Sinclair Water Authority
984,3689342,0,0,0,0,3689342,0,0,0,0,Smyrna Downtown Area Development Corporation
985,330950,0,0,0,0,330950,0,0,0,0,Smyrna Housing Authority
986,7075,11396,11396,61.696712,61.696712,7075,11396,11396,61.696712,61.696712,Social Circle Development Authority
987,14126921,0,0,0,0,14126921,0,0,0,0,"Solid Waste Management Authority of Athens-Clarke County, Georgia"
988,8804171,0,0,0,0,8804171,0,0,0,0,Solid Waste Management Authority of Atkinson County
990,0,0,0,,,0,0,0,,,Solid Waste Management Authority of Charlton County
992,64294339,0,0,0,0,64294340,0,0,0,0,Solid Waste Management Authority of Crisp County
993,0,0,0,,,0,0,0,,,"Solid Waste Management Authority of Franklin County, Georgia"
994,0,0,0,,,0,0,0,,,"Solid Waste Management Authority of the City of LaGrange, Georgia"
995,7365335,0,0,0,0,7365335,0,0,0,0,South Fulton Municipal Regional Jail Authority
996,0,0,0,,,0,0,0,,,South Fulton Municipal Regional Water and Sewer Authority
998,27553833,0,0,0,0,27553832,0,0,0,0,South Georgia Governmental Services Authority
1000,6729663,1385654,0,17.074553,0,6729663,1385654,0,17.074553,0,South Georgia Regional Information Technology Authority
1001,0,0,0,,,0,0,0,,,South Regional Joint Development Authority
1002,809441,1947822,0,70.643318,0,809441,1947822,0,70.643318,0,Southeast Georgia Consolidated Housing Authority
1003,3137154,0,0,0,0,3137154,0,0,0,0,Southeast Georgia Joint Development Authority
1004,93892,0,0,0,0,93892,0,0,0,0,Southeast Georgia Regional Development Authority
1005,0,0,0,,,0,0,0,,,Southwest Georgia Regional Development Authority
1006,0,0,0,,,0,0,0,,,Southwest Georgia Technology Authority
1007,1112172,168595,15598,13.163596,1.217864,1112172,168595,15598,13.163596,1.217864,"Spalding County Collaborative for Families & Children, Inc."
1008,30346043,0,0,0,0,30346044,0,0,0,0,Spalding County Water and Sewerage Facilities Authority
1009,238,0,0,0,0,238,0,0,0,0,Sparta-Hancock County Development Authority
1011,91988.70999999999,0,0,0,0,91988.711,0,0,0,0,St. Marys Airport Authority
1012,61129,243593,243593,79.939423,79.939423,61129,243593,243593,79.939423,79.939423,St. Marys Convention and Visitors Bureau Authority
1013,58158,0,0,0,0,58158,0,0,0,0,St. Marys Downtown Development Authority
1014,217672,3893270,3554746,94.705055,86.470352,217672,3893270,3554746,94.705055,86.470352,Stephens County Development Authority
1015,192393800,0,0,0,0,192393792,0,0,0,0,Stephens County Hospital Authority
1017,0,0,0,,,0,0,0,,,Sumter County Industrial Development Authority
1018,628909,0,0,0,0,628909,0,0,0,0,Sumter County Livestock Authority
1019,36349,0,0,0,0,36349,0,0,0,0,Suwanee Downtown Development Authority
1021,0,0,0,,,0,0,0,,,Swainsboro Emanuel County Parks and Recreation Authority
1023,0,0,0,,,0,0,0,,,Sylvester Development Authority
1024,549800,0,0,0,0,549800,0,0,0,0,Tallapoosa Development Authority
1025,589230,0,0,0,0,589230,0,0,0,0,Tallapoosa Recreation Authority
1026,234,133146,133146,99.824562,99.824562,234,133146,133146,99.824562,99.824562,Tattnall County Development Authority
1027,34417,10177,0,22.821455,0,34417,10177,0,22.821455,0,Taylor County Airport Authority
1028,66800,0,0,0,0,66800,0,0,0,0,Taylor County Building Authority
1029,101509,0,0,0,0,101509,0,0,0,0,Taylor County Development Authority
1030,0,0,0,,,0,0,0,,,Taylor County Waste Management Authority
1031,0,0,0,,,0,0,0,,,Taylor County Water and Sewerage Authority
1032,117136,0,0,0,0,117136,0,0,0,0,Telfair County Hospital Authority
1033,0,0,0,,,0,0,0,,,Telfair-Wheeler Airport Authority
1034,498157,0,0,0,0,498157,0,0,0,0,Telfair-Wheeler Joint E-911 Authority
